id,year,keywords,imagenum,_verfasser,_ort,_titel,_umfang,_inhalt,_beilagen
KnF_1758-32,1758,"Flugschrift,Großbritannien,Österreich,Frankreich,Reich,Reichsverfassung,Bündnissystem",11,,1758,"Kurze Erläuterung derjenigen Staats-Revolutionen, welche sich seit 1748 bis 1756 zugetragen, und die ersten Funken des itzigen Kriegsfeuers angezündet haben. Aus Originalberichten derer Gesandten, aus ihren mündlichen Vorstellungen, und aus denen Negotiationsacten mit verschiedenen Höfen zusammen getragen.",12 Seiten,"der Frieden von Aachen und seine Folgen für England und Frankreich; zur römischen Königswahl; die russischen Truppen in Holstein; unerlaubte Nebenwege zur Wahl und die Wahlkapitulation; der Westfälische Friede als neue Vorschrift der Reichsverfassung; Abhandlung über die katholische und protestantische Alternative; zum Krieg zwischen England und Frankreich und dem Barrieretraktat mit Holland; das Corpus Germanicum (Einführung des neuen Reichssystems) als Strafe für den Kurfürsten von Hannover und die Folgen für Hannover, Preußen und Österreich; preußische Erklärung zum Tractat mit Hannover; protestantische Gesandtschaften in Regensburg; Frankreich als Garant des Westfälischen Friedens;  Reichsstände lachen über den Kaiser und sind in Angst und Schrecken vor Preußen; die Geheimen Artikel vom 12. Mai 1756. ",
KnF_1758-33,1758,"Flugschrift,Großbritannien,Bündnissystem",14,,"Amsterdam, 1758","Troisiéme Coup-D'œil Sur Ma Patrie, Traduit de l'Anglois.",14 Seiten,"Lateinische Aufforderung: ""Lasst uns die Hausherren verstehen"" (übersetzt von  ); englische Schrift auf französischer Sprache übersetzt; Autor kritisiert englische preußische Vorherrschaft in England preußische Tyrannis; berichtet von Korruption der Minister; diese handeln im Interesse ihres Käufers, nicht im nationalen; König kann Änderung bringen, d.h. für eine Besserung des Zustandes soll die Monarchie unterstützt werden, auch von Unterhaus; Krieg bedeutet Ruin für England, weil er falsch geführt wird und Geld sinnlos ausgegeben wird; Krieg sei im Interesse Preußens; Kriegshandlungen englischer Flotte in Frankreich seien eher Freibeuterei; Krieg soll beendet werden und ein Handelsgleichgewicht angestrebt werden, im Interesse Englands und Europas; Unabhängigkeit der Krone als Lösung; Stärkung der eingene Sicherheit, Religion und Freiheit.",
KnF_1758-34,1758,"Flugschrift,Ruhm,Würde,Kriegsalltag",35,,"Königsberg, 1758",Moralische Schilderung eines wahren unüberwindlichen Helden nach dem vollkommensten Muster unserer Zeiten entworfen von Fridlibio.,36 Seiten,"Die Untertanen handeln mit Unverstand und machen sich damit des ""Lasters der Parteilichkeit"" schuldig; Auflistung der Eigenschaften eines wahren Helden sollen den Untertanen helfen die Fakten richtig zu beurteilen;drei Regeln, um als christlicher Fürst Krieg zu führen;
als Verräter der christlichen Religion gilt derjenige Fürst, der ohne Not, aus Herrschsucht und lasterhaften Eigenabsichten die Waffen ergreift; einem christlichen Fürsten ist es erlaubt, sich gegen einen Tyrannen zu verteidigen; Frankreich als Beispiel für einen unchristlichen Fürsten ( Motive: Neid und Aufwiegelei);
Unterstützung im Notfall ist übernatürliche Hilfe; Definition über christlich erlaubte Bündnisse und unmenschliche Teilungstraktate; Prophezeiung über Gottvertrauen und Unglauben; Gott als Unterstützungsmacht für friedliche Fürsten; Erörterung über die Ablehnung der Türken als christliche Bündnispartner; zur Kriegslist und dem Vergleich antiker Schlachten;
zum Verhalten eines christlichen Fürsten nach dem Sieg; unehrenhafte Verfolgung der Feinde nach dem Sieg; unehrenhaftes Verhalten der Franzosen; Friedensvorschläge als Tugend; Vergleich mit den Römerheeren und den Scipionen; Prophezeiung über die Gerechtigkeit, den Frieden und den Seegen Gottes. ",
KnF_1758-35,1758,"Flugschrift,Preußen,Österreich,Natur- und Völkerrecht,Sachsen,Frankreich,Russland,Schweden,Reich,Großbritannien,Polen",35,,1758,"Das Orakul eines Schweizers, woraus man deutlich sehen kann, wer von denen kriegenden hohen Mächten bey gegenwärtigen Krieg Vortheil oder Schaden ziehen wird.","2 Blatt, 31 Seiten","Vorrede über die Unruhe und die Verwirrung, die innerhalb Europas herrscht; allgemeine Verunsicherung über den Kriegsausgang; Orakel-Befragung aller einzelnen Kriegsparteien;  Hoffnungen und Besorgnisse über bisherige Entscheidungen , Orakelbefragung durch Kaiser von Österreich, die Königin von Österreich, den König von Preußen, den Kurfürst von Sachsen, den König von Frankreich, die russische Kaiserin, den König von Schweden, den Kurfürst von Mainz, die Reichsstädte, den Kurfürst von Hannover, den Landgrafen von Hessen, England, Holland, Dänemark, Polen und Italien.  Warnungen und Ratschläge des Orakels für weitere Kriegshandlungen an jeden Fragenden. ",
KnF_1758-36,1758,"Flugschrift,Preußen,Reich,Reichsverfassung,Kriegsbild,Soldatentum,Streitschrift",19,,"Frankenhausen, 1758",Das gerochene Franken wegen der von denen Königl. Preußischen Trouppen zu zweymalen unternommenen widerrechtlichen und feindlichen Ueberziehung des Fränkischen Craißes.,20 Seiten,"Sieg in der Schlacht von Prag ist Anlass für Truppenentsendung Preußens ins Reich; Neutralität weiterer Gebiete soll erzwungen werden; Einfall ins Bamberger Gebiet, Erpressung von Verpflegung und Geldsummen; Belagerung Nürnbergs, Sicherungsmaßnahmen durch Stadtmagistrat; Nürnberg von Belagerung befreit; Preußische Erpressung von Lieferungen aus Schwabach; Beschuss und Brandsschatzung in Weißmann durch preußische Truppen; Fränkische Truppen rücken an, Rückzug der Preußen; Schlacht von Kollin; Aufhebung der Belagerung Prags, Erhebung von Kontibutionen in Bamberg und Geiselnahmen; Rückzug der Preußen aus Franken; Überfall auf preußischen Munitionstransport; Coup der Österreicher führt zur Aufgabe der Belagerung von Olmütz.",
KnF_1758-37,1758,"Flugschrift,Gedicht,Patriotismus,Österreich,Sachsen,Preußen,Reich,Frankreich,Großbritannien,Schweden,Polen",55,,"Straßburg: Faust, 1758","Das Orakel jetziger Zeit, welches von allen Europäischen Nationen und mancherley Ständen um Rath gefraget wird.",56 Seiten,"Ratschläge des Orakels zum klugen Verhalten in Kriegszeiten, Besorgnisse der Fragenden: Patriot-ungeheure Kriegsheere und Lügenverbreitung,Österreicher-Beschwerde über Patrioten; Selbsterhaltung und Verbindlichkeit, Sachsen als preußische Schatzkammer, Brandenburger-Schilderungen zur Finanzkatastrophe  unter Graf von Brühl, ein Westfale-zur Einquartierung in Kleve, Schweizer- zur Lausanner Niederlage und Freiheitsverteidigung,Holländer- über Seekaperei der Engländer, Ungar-über Verwandschaft und Freundschaft zu Kroaten und Deutschen,Hannoveraner- zur Konvention von Kloster Zeven, Franzose- über englische Ungerechtigkeiten, Haß und Vorurteile,Engländer- über öster.Heuchelei, Spanier-über Neutralität und Pfaffen, Portugiese- über Verrat der Jesuiten, Italiener- über Venez. Geldverleih, Däne-zur Holsteinischen Observationsarmee, Schwede- zu Pommerschen Unternehmungen, weiter zu Russen, Polen und Türken. ",
KnF_1758-38,1758,"Flugschrift,Zeitung,Österreich,Schlacht,Kriegsalltag",11,,"Breslau, [1758]","Verzeichnis Derer Herren Generals, Militair- Staabs- und andern Officiers, auch Unter-Officiers und Gemeinen, von denen Oesterreichischen Trouppen, so den 16. April. 1758. zu Schweidnitz in die Kriegs-Gefangenschaft verfallen.",6 Blatt,"Nach Regimentern und Waffengattungen sortierte Auflistung der in Schweidnitz gemachten österreichischen Kriegsgefangenen (Namen und Anzahl), Auflistung der übergebenen feindlichen Geschütze.",
KnF_1758-39,1758,"Flugschrift,Gedicht,Schlacht,Preußen,Russland,Ruhm",7,,"Berlin, 1758",Ode auf den Unschätzbaren Sieg bey Zorndorf von J. F. S.,4 Blatt,"Angriff, Brandschatzung und Zerstörung der Festung Küstrin, Anbetung Gottes und Zuspruch, Schlacht, Friedrich II. sammelt sein Heer, Kampf und Gefecht, große Verluste, preußischer General von Seidlitz greift erneut an, endgültiger Sieg, Heldentat, Staat und Land gerettet. ",
KnF_1758-4,1758,"Flugschrift,Staatsschrift,Preußen,Geschichte als Argument",15,,1758,"Lob der Historie und von dem Nuzen, welchen Hohe und Niedrige in der Welt aus dem rechten Gebrauch der historischen Wissenschaften und von denen ans Licht kommenden Staatsschriften, mit einer Ermahnung an solche Gelehrte, welche eine historische Wissenschaft haben, die Geschichte des jezigen so sehr merkwürdigen Krieges, mit unpartheiischer und wahrhaftiger Feder zu beschreiben.",15 Seiten,"Loblied auf die historischen Wissenschaften; diese zeigen dem Leser das Wirken Gottes, sind für das Verständnis der Welt unumgänglich; sie schaffen Unvergänglichkeit; so sie der „Wahrheit“ verpflichtet und nicht interessengeleitet sind, überragt ihr Nutzen für die Menschen alle anderen Wissenschaften überlegen; eine unparteiische, quellenkritische Untersuchung zum gegenwärtigen Krieg fehlt bisher, aber sicher ist: Friedrich II. kämpfte 1756/1757 gegen 5 der mächtigsten Staaten Europas (Reichsarmee, österreichische, russische, französische und die schwedische Armee) erfolgreich; diese Erfolge sind es wert, in einer historischen Schrift verewigt zu werden; historiographische Untersuchung an den Schriften zum Dreißigjährigen Krieg.",
KnF_1758-40,1758,"Flugschrift,Ruhm,Gedicht,Schlacht,Preußen,Russland",7,,"Berlin, [1758]","Der unvergeßliche Zehnte Sieg Friedrich des Großen, welcher über die ganze Rußische Armee bey Zorndorf den 25sten August 1758. erfochten wurde, wird patriotisch besungen von J. H. S. R.",4 Blatt,"Sieg über sechs Feinde, Friedrich II. als Schrecken von Österreich, Kampf gegen russischen Heerführer Wilhelm von Fermor, Verwüstungen, Russland und Österreich verbünden sich um Schlesien zurückzuerobern, Rückbesinnung auf die Schlacht von Rossbach, die Preußen vertreiben das russische Heer, Wilhelm von Fermor geschlagen, Warnung an die Zarin von Russland und die Kaiserin von Österreich, Lobpreisung Friedrichs II., Himmelskräfte wirken gegen die Friedensstörer, Treueeid auf den König von Preußen. ",
KnF_1758-41,1758,"Flugschrift,Preußen,Panegyrik,Ruhm",35,"Sulzer, Johann Georg","Berlin: Grynäus und Decker, [1758]","Lobrede auf den König, Welche den 24sten des Jenners 1758. an Seiner Majestät Gebuhrtstage auf dem Königl. Joachimsthalischen Gymnasio gehalten worden von J. G. Sulzer, Mitgliede der Königl. Academie der Wissenschaften und Professor der Mathematik.",35 Seiten,"Vorrede an den Prinz von Preußen (Friedrich Wilhelm II.) von J.G.Sulzer, Lobrede auf den 24. Januar 1758 (Geburtstag Friedrichs II.), Friedrich II. als vollkommener Regent, Held und Beschützer, Ämter und Pflichten eines Königs, das bewaffnete Heer als gefährliches Werkzeug, private Lebensart in Sanssouci, die Bündnisse der Feinde, Treue gegenüber Friedrich II. und seine großen Taten, Anrücken feindlicher Heere, die Taten Friedrich Wilhelm I. sowie Friedrich III./I., Krieg in Sachsen und Thüringen, die Verteidigung Schlesiens, die Schlacht von Leuthen, Ehrung Friedrich II.  ",
KnF_1758-42,1758,"Flugschrift,Ruhm,Panegyrik,Preußen",29,"Sulzer, Johann Georg","Berlin, 1758","Lobrede auf Den König, welche den 24. des Jenners 1758. Seiner Majestät Gebuhrtstage, auf dem Königlichen Joachimsthalischen Gymnasio gehalten worden, von J. G. Sulzer, Mitglied der Königl. Academie der Wissenschaften, und Professor der Mathematik.",30 Seiten,"Vorrede an den Prinz von Preußen (Friedrich Wilhelm II.) von J.G.Sulzer, Lobrede auf den 24.01.1758 (Geburtstag Friedrichs II.), Friedrich II. als vollkommener Regent, Held und Beschützer, Ämter und Pflichten eines Königs, das bewaffnete Heer als gefährliches Werkzeug, private Lebensart in Sanssouci, die Bündnisse der Feinde, Treue gegenüber Friedrich II. und seine großen Taten, Anrücken feindlicher Heere, die Taten Friedrich Wilhelm I. sowie Friedrich III./I., Krieg in Sachsen und Thüringen, die Verteidigung Schlesiens,die Schlacht von Leuthen, Ehrung Friedrich II.  ",
KnF_1758-43,1758,"Flugschrift,Gedicht,Soldatentum,Kriegsalltag",25,,1758,Die Abbildung eines Schlacht-Feldes und die Buße eines hart bleßirten sterbenden Soldaten samt einem Anhang zum Lobe der Dreyeinigkeit Gottes.,13 Blatt,"Beschreibung Schwerverletzter beim Gang über ein Schlachtfeld nach dem kampf, Abscheuliche Eindrücke von Verwundeten und Verstümmelten, Soldat ohne Beine erhält Hilfe, Gedanken über Wollust, Alkohol, Erinnerung an vergangene Zeiten, Angst vor dem Tod, Ankunft im Hospital, Schmerz und Verzweiflung, vor dem letzten Gericht, Gedanken an Jesu Kreuzigung, Verabschiedung und Erlösung. ",
KnF_1758-44,1758,"Flugschrift,Brief,Gedicht,Soldatentum",3,,1758,Ein Poetisches Schreiben eines Preußischen Husaren aus Leipzig an seinen Vetter nach Magdeburg.,2 Blatt,"Frankreich, Russland und Österreich kämpfen gemeinsam gegen Preußen, die Preußen sind dennoch nicht ängstlich, Erinnerung an die Bataille von Merseburg (Rossbach) und den Sieg, Flucht der Feinde in die Saale, Sieg bei Pirna, Friedrich II. versetzt seine Gegener in Angst und Schrecken, Quartier in Leipzig. ",
KnF_1758-45,1758,"Flugschrift,Briefwechsel,Preußen,Sachsen",15,,"Warschau, 1758",Die Macht der Warheit in einem Schreiben des Herrn Grafen von Brühl an einen Kaufmann in Berlin und der Antwort des leztern.,16 Seiten,"Verräter aus Sachen (Kabinetts Kanzelist Friedrich Wilhelm Menzel) begeht Geheimnisverrat, Weiterleitung von Depeschen aus dem sächsischen Archiv, 24.11. 1757 Arrest und Verhör von Menzel, im Verhör Schuldbekenntnis über Veräußerung von Depeschen aus dem Dresdner und Warschauer Archiv / Departement auswärtige Geschäfte gegen Geld (3.000 Taler), Komplizen Sekretär Pleßmann und Benoit, gegenseitige Schuldzuweisungen in Verhören, Veröffentlichung sächsischer Archivstücke am preußischen Hof, niederträchtige Handlungen am preußischen und sächsischen Hof auf Befehl der Monarchen, Frage von Selbstbetrug und Hinterlist. ",
KnF_1758-46,1758,"Flugschrift,Konfession,Polemik",23,,[1758],"Treuherzig-gemeynte Vorstellung und recht väterliche Ermahnung Wie nach dem wahren Sinne des apostolischen Stuhls zu Rom, die unter den chrsitlichen Potenzien zeithero obschwebenden Land und Leut verderblichen Mißhelligkeiten, nicht nur sehr leicht aus dem Grunde gehoben, und vollkommentlich abgethan, sondern zugleich auch eine ganz unzertrennliche und ewig fortwährende Freundschaft errichtet; durch welche Vereinbarung christcatholischer Fürsten, zeitliches Glück, Macht und Hoheit, mittelst Unterthänigmachung und Beherrschung des ganzen Erdbezirks, [...], allermeist aber durch Ausrottung gesammter Ketzereyen vollkommen befördert werden können.",24 Seiten,"Ermahnungen und Vorschläge des heiligen Stuhls in Rom an die streitenden Mächte, Wahrheit der Katholischen Kirche muss über lutherische Ketzereien siegen, Ermahnung an den König von Polen zur Friedensschließung und zur Herstellung der Eintracht der Katholischen Parteien, weiteres Blutvergießen verhindern, Verbindung und Heiratspläne zwischen den Häusern Habsburg und Bourbon, Verzicht des spanischen Königs Don Carlos auf Neapel und Sizilien, Bündnisse zwischen Frankreich und Spanien, um Gibraltar und Porto Mahon zurückzuerlangen, Allianzen gegen die Türken, dauerhafte Freundschaften zur Schließung des Heiligen Bundes, Herstellung alter Reichsgrenzen, ewiger Verzicht auf Gebietsansprüche, Schaffung von Blutsfreundschaften, Sicherung der Mittelmeerküsten, Wahl zum neuen Deutschen Kaiser, Friedensverträge und Allianzen von Frankreich, Spanien und Österreich gemeinsam gegen calvinistische Ketzer, russischer Krieg gegen Schweden zur Verhinderung der Unterstützung für Deutschland. ",
KnF_1758-47,1758,"Flugschrift,Predigt,Schlacht,Preußen,Russland",39,"Ortmann, Adolph Dietrich","Berlin: Voß, 1758","Adolph Dieterich Ortmanns Inspectors zu Belitz Sieges-Predigt wegen der Schlacht bey Zorndorf gehalten über Jesaia, 26. v. I. 2. in der Kirche zu Belitz.",40 Seiten,"Schlacht bei Zorndorf; Sieg über russisches Heer; Schilderungen von Grausamkeiten, Gewalt und Elend an Frauen, Kindern und Greisen; Verwüstung und Plünderung der Kurmark; Einfall österreichischer und französischer Truppen an der Grenze; Friedrich II. als Werkzeug in der Hand Gottes; Hoffnung und Gebet an Gott; Rettung  und Segnung; Lobgesang auf Stadt und Land; Gottes Gericht und Heimsuchungen; Errettung durch Gott; Sieg und Segnung des Landes; Dank und Lob Gottes; Segnung Friedrichs II. und der preußischen Armee. ",
KnF_1758-48,1758,"Flugschrift,Preußen,Ruhm,Panegyrik",43,,1758,Accurates Portrait Friderichs des Grösten Königs in Preußen. Oder Beantwortung der Frage: Was der König in Preußen vor ein Herr sey?,44 Seiten,"Beschreibung des ""großen"" Charakters Friedrichs II. (göttliche Kraft des Verstandes, Scharfsinnigkeit, Tugendhaftigkeit); Standhaftigkeit und Tapferkeit gegenüber dem Feind; Antimachiavell; Weisheit der Seele; Siege in Strigau (Hohenfriedberg), Mollwitz, Dresden, Prag, Rossbach und Lissa; Menschlichkeit und Gnade auf dem Schlachtfeld; Tod Sophie Dorotheas von Hannover (Mutter); Wohltätigkeit; Orden Pour le Mérite; Einstellung des Königs zu Ausgaben und Verschwendung; Ceremoniell und Gesellschaft; Ruhm, Verläumdungen und Freundschaft. ",
KnF_1758-49,1758,"Flugschrift,Predigt,Preußen,Russland,Schlacht",19,"Wegener, Karl Friedrich","Berlin, 1758","Dank-Predigt über den herrlichen Sieg, welcher von Seiner Majestät unserem Grosen Monarchen Den 25sten August 1758. bey Zorndorf gegen die Russen in Höchsteigener Person erfochten worden; gehalten in der hiesigen Garnisonkirche an dem 15ten Sonntage nach Trinitatis von Carl Friederich Wegener, Garnisonprediger.",20 Seiten,Untertänigste Anrede und Ergebenheit an die Königin von Carl Friedrich Wegener;  Dank und Lob Gottes für die Wohltat des Sieges in Zorndorf; Errettung vor dem Feind; Ursachen der Errettung; Dankbarkeit; Unerschrockenheit und Stärke des preußischen Königs; Treue der Untertanen zum König; Fürbitte zum Schutz des Königs und der preußischen Truppen. ,
KnF_1758-5,1758,"Flugschrift,Schlacht,Zeitung,Preußen,Österreich,Sachsen,Kriegsschuldfrage,Konfession,Reich",49,,1758,Der wegen der Schlacht bey Rosbach und Neumark todtkrancke Pasquinus nebst dessen merkwürdiger Abschiedsrede den gegenwärtigen Krieg betreffend.,50 Seiten,"Spöttischer Kommentar Pasquins zum Krieg und dessen Verlauf im Reich in Form eines Rückblicks und Abschieds; Jugend; Ausbildung; Reisen; Spott über die Staatsschriften und die zur Verteidigung der jeweiligen Politik verwendete Argumentation, da sich in ihnen letztlich alle am Krieg Beteiligten auf die selben Gesetze und Rechte berufen; die eigenen Absichten werden dem Anderen unterstellt; Klage über die Lage und das Leid Sachsens, aber auch Friedrich II. kann sich auf das Recht berufen; letztlich leidet Sachsen an seiner militärischen Schwäche; die kriegführenden Parteien sollen sich bekämpfen, bis es einen Sieger gibt, oder die Ressourcen der Länder verbraucht sind; das Streben nach „Vergrößerung“ ist allen Menschen eigen, nicht nur den Monarchen; Testament Pasquins",
KnF_1758-50,1758,"Flugschrift,Predigt,Preußen,Kriegsalltag",15,"Sadewasser, Christian Friedrich","Berlin: Rüdiger d. J., 1758","Christian Friederich Sadewassers Königl. Preußischen Neumärckischen Consistorial-Raths, Pastoris und Inspectoris zu Cüstrin Erste Rede welche er nach der gäntzlichen Einäscherung dieser Stadt Domin. XV. p. Trin. über die Worte Daniels Cap. 9, v. 7. Herr, du bist gerecht, wir aber müssen uns schämen, zwischen denen Schutt und Aschenhaufen dieser verheerten Stadt gehalten hat. Auf Verlangen dem Druck übergeben.",16 Seiten,Ermahnung und Gebet Christian Friedrich Sadewassers an die Überlebenden von Küstrin; Zerstörung der Stadt am 15. August 1758; Bekenntnisgebet und Bitte um Zuwendung Gottes; Gottes Gerechtigkeit und Züchtigung für alle; Ephraim und die Stämme Israels; Warnung an die Sünder; Bußgebet Daniels ( immer wiederkehrend); Zerstörung Küstrins als Zorn Gottes; Sieg in der Schlacht von Zorndorf am 25./26. August 1758; Gottes Gnade und Gerechtigkeit.  ,
KnF_1758-51,1758,"Flugschrift,Schlacht,Kriegsverlauf,Soldatentum,Preußen,Russland",3,,1758,"Zuverläßige Nachricht von der den 25. Aug. bey Zornsdorf vorgefallenen sehr hitzigen und fast 2 Tage continuirlichen Action des Königs von Preußen mit der Rußischen Armee, nebst der Specification der Ruß. gefangenen Generals.",2 Blatt,"Bericht über die Schlacht bei Zorndorf 25. August 1758; Preußischer Sieg; Rückzug der russischen Armee nach Küstrin; die russische Armee ist im Moment ungefährlich, da ohne Munition; Siegeszeichen (Kanonen, Fahnen und 2 Paar Pauken); Kriegsgefangene u. a. 6 russische Generäle; während diese mit Friedrich II. speisen, lagern die bis zu 10.000 gefangenen Soldaten auf freiem Felde, Verluste beider Seiten, Wirkungslosigkeit der russischen Artillerie, während die Wirkung der preußischen Kanonen verheerend war; Feuergeschwindigkeit beider Armeen; General-Kriegskasse der Russen ist in den Händen Friedrichs; Verwendung dieser Gelder für die Wiederaufbau Küstrins.",
KnF_1758-52,1758,"Flugschrift,Schlacht,Preußen,Russland",3,,[1758],"Relation Des Avantages remportés sur le Roi de Prusse par l'Armée de Russie, avec la description de la Bataille la plus meurtriere qui se soit donnée de mémoire d'hommes.",4 Seiten,"Schlacht von Zorndorf am 25. August 1758.
Akteure auf russischer Seite waren Graf Fermor, General Browne; Auf preußischer Seite wird nur Friedrich II. erwähnt; Schlachtbeginn am; 25. August um 9 Uhr; Angriff ging von Preußen aus; gegen Mittag Zurückdrängen der Preußen und Fall der ersten preußischen Linie, Angriff der russischen Kavallerie auf die preußische Infanterie an; viele Tote.
Friedrich II.  drängt Russen zurück; wird als Sieger gefeiert; Neuer Angriff der Russen; drängen Preußen zurück; 21 verlorene Kanonen auf russischer Seite; 26 gewonnene Kanonen plus Fahnen, mit 25 00 Toten und 2000 preußische Gefangenen; beide Seiten feiern Sieg; russische Siegesfeier irritierte Friedich II. und führte zu erneutem preußischen Angriff, der zurückgeschlagen wird; General Browne schwer verletzt.",
KnF_1758-53,1758,"Flugschrift,Preußen,Gedicht,Ruhm,Kriegsverlauf,Soldatentum",29,,"Berlin, 1758","Friederich Der Sieger. Ein Heldengedicht, Erstes Buch.",30 Seiten,"Friedrich II. als Kriegsheld; preußische Tuppen marschieren in Sachsen ein; vier Hauptverbündete gegen Preußen, 1. Schlacht auf europäischem Kriegsschauplatz; Kampf bei Pirna; eingeschlossene sächsische Truppen zwischen Sonnenstein und Festung Königstein; Vormarsch unter Feldmarschall Maximilian Browne; preußischer Sieg; Marschall James Keith in Peterswald; Schlacht von Lobositz; Regimenter Itzenblitz und Mannteufel; 2. preußischer Einfall nach Böhmen; 6. Mai 1756 Heeresvereinigung bei Prag und Schlacht gegen Österreicher, Heldentod Generals Christoph von Schwerin; Bombardement und Belagerung Prags; Abzug nach Kolin und Kullenberg, 1. Niederlage Friedrichs II. bei Kolin; Gott als Preußens Freund; Sieg in der Schlacht von Rossbach. ",
KnF_1758-54,1758,"Flugschrift,Preußen,Konfession,Gedicht",3,,1758,"Sehr artige Vorstellungen seltener Dinge, die Zeit wirds Lehren. Samt einen Anhang von verschiedenen politischen Fragen.",2 Blatt,"Zukunfstfragen des Kriegsgeschehens bezüglich Portugal, Spanien, Frankreich, Holland, Deutschland, Österreich, England, Preußen, Dänemark, Polen, des türkischen Hofes und der Reichsarmee sind noch nicht entschieden; Preußischer König als Beschützer der Evangelisch Lutherischen Religion; Verbündete gegen Preußen (Ungarn, Russland und Frankreich) sind in Glaubensfragen uneinig; Glaubensbekenntnis und Gründe für den Kriegseintritt Preußens; Jesuiten sollen sich besser Friedrich II. zuwenden. ",
KnF_1758-55,1758,"Flugschrift,Österreich,Schlacht,Satire",3,,1758,Der hinkende Bothe oder die aufgehobene Belagerung von Neisse. Ein Trauerspiel von drey Auftritten.,2 Blatt,General Philipp von Harsch will die Festung Neisse erobern; Friedrich rückt mit preußischen Streitkräften an; General von Harsch muss Belagerung daraufhin abbrechen; absichtliche Falschmeldung über die preußische Truppenstärke (60000 Mann) durch General von Harsch an die Kaiserin. ,
KnF_1758-56,1758,"Flugschrift,Schlacht,Preußen,Österreich,Kriegsalltag,Kriegsverlauf",3,,[1758],"Preußische Nachricht von der blutigen Action, welche zwischen den 13ten und 14ten October bey Weisenberg ohnweit Bautzen in der Ober-Lausitz vorgefallten.",2 Blatt,"Preußische Darstellung der Schlacht bei Hochkirch (14. Oktober 1757); Zurückweisung von Nachrichten, wonach die preußische Armee vernichtend geschlagen und zerstreut worden wäre; Sammlung und Heeresvereinigung bei Großenhain unter Markgraf Carl aus Schlesien; Feldmarschall von Keith stößt mit Verstärkung zu den Truppen; Vorgefechte: Angriff durch Laudon abgewehrt; hinterlistiger Überfall bei Nacht und Nebel; Auflistung der Gefangenen; Rückzug der Armee in guter Ordnung und auf Befehl; unter den Gefallenen sind der Feldmarschall von Keith und der Prinz Friedrich Franz von Braunschweig-Wolfenbüttel; Verlustmeldung nach unten korrigiert (weniger als 3.000 Tote Preußen); Abzug der Österreicher; Bautzen soll sich weiterhin in preußischer Hand befinden; Gefechte bei Pirna.",
