id,year,keywords,imagenum,_verfasser,_ort,_titel,_umfang,_inhalt,_beilagen
KnF_1756-1,1756,"Flugschrift,Reskript,Dokumentenanhang,Österreich,Staatsschrift",19,"Kaunitz-Rietberg, Wenzel Anton von","Wien, Prag: Trattner, 1756",Kaiserlich-Königliches Circular-Rescript de dato den 20. Septembris 1756.,20 Seiten,Maria Theresia widerlegt Friedrichs II. Legitimierung des Überfalls auf Sachsen; weist den Vorwurf der Rüstungen von sich; Verstöße gegen das Völkerrecht aufseiten Friedrichs II.; unakzeptables Verhalten der Preußen gegenüber der polnisch-sächsischen Königsfamilie.,"I. Inhalt der mündlichen Antwort Ihro Majestät der Kaiserin Königin / Precis De la reponse verbale de sa Majesté l´Imperatrice Reine; II. Erstes Memoire des Preußischen Ministers von Klinggräff / Memoire de Msr. de Klinggraeff Ministre du Roi de Prusse, III. Antwort auf das von den von Klinggräff den 20 August übergebene Memoire / Reponse Au Memoire présenté par Monsieur de Klinggraeff le 20. Aout 1756; IV. Zweytes Memoire des Herrn von Klinggräff / Memoire de Mr. de Klinggräff; V. Antwort auf das zweyte Memoire des Herrn von Klinggräff, vom 2ten Sept. 1756 / Reponse au second Memoire présenté par Mr. de Klinggraeff, le 2. Septembr. 1756; VI. Extract Graf Sternbergischen Bericht-Schreibens, de dato Dresden den 10. Septembris 1756."
KnF_1756-10,1756,"Flugschrift,Brief,Reichsverfassung,Preußen,Österreich,Natur- und Völkerrecht,Rechtsfrage,Kriegsschuldfrage,Geschichte als Argument",27,"[Kahle, Ludwig Martin]",1756,"Schreiben eines Freundes aus L** an einen Freund in Cölln am Rhein, über das Kayserliche Hof-Decret vom 14. Sept. 1756. und die darin befindlichen Avocatorien.",28 Seiten,"Propreußische Auseinandersetzung  eines nicht namentlich erwähnten Autors in einem Schreiben an dessen Bekannten mit dem an den Reichstag gerichteten kaiserlichen Hof-Decret vom 14. September 1756 an den Reichstag, „den gewaltsamen Einfall in die Chur-Sächsische Lande von denen Chur-Brandenburgischen Völkern, betreffend“; im Mittelpunkt stehen die Doppelnatur des Kaisers als Oberhaupt des Reiches und als Gemahl der Erzherzogin von Österreich, die Rolles Reichshofrates sowie das Recht der Reichsstände zur Selbsthilfe und die entsprechenden Regelungen im Landfrieden.
Der Kaiser und der Reichshofrat sind nicht neutral; letzterer dient der Durchsetzung der habsburgischen Interessen.
",
KnF_1756-11,1756,"Flugschrift,Brief,Reichsverfassung,Preußen,Österreich,Natur- und Völkerrecht,Rechtsfrage,Kriegsschuldfrage,Geschichte als Argument",27,"[Kahle, Ludwig Martin]",1756,"Schreiben eines Freundes aus L** an einen Freund in Cölln am Rhein, über Das Kayserliche Hof-Decret vom 14ten Septbr. 1756. und die darin befindlichen Avocatorien.",28 Seiten,"Propreußische Auseinandersetzung  eines nicht namentlich erwähnten Autors in einem Schreiben an dessen Bekannten mit dem an den Reichstag gerichteten kaiserlichen Hof-Decret vom 14. September 1756 an den Reichstag, „den gewaltsamen Einfall in die Chur-Sächsische Lande von denen Chur-Brandenburgischen Völkern, betreffend“; im Mittelpunkt stehen die Doppelnatur des Kaisers als Oberhaupt des Reiches und als Gemahl der Erzherzogin von Österreich, die Rolles Reichshofrates sowie das Recht der Reichsstände zur Selbsthilfe und die entsprechenden Regelungen im Landfrieden.",
KnF_1756-12,1756,"Flugschrift,Geschichte als Argument,Brief,Sachsen,Preußen,Soldatentum",29,"[Maubert de Gouvest, Jean Henri]","Varsovie: Zanki, 1756","Sisteme Et Conduite De La Prusse, Ou Lettres D'un General Saxon A Un Gentil Homme Silesien Dans les Armées Prussiennes; Pour servir de Réponse Aux Manifestes, Exposés, Memoires, Remonstrances, & autres Ecrits, Du Ministere Prussien.",30 Seiten,"Schreiben eines vorgeblich sächsischen Generals im Ausland (Thüringen) an seinen in preußischen Diensten stehenden Vetter, ein Baron aus Schlesien; der erste Brief, angeblich in Jena am 29. Oktober 1756 verfasst, reagiert auf ein Angebot des Barons an den General, ebenfalls in den Dienst Preußens zu treten.; zweites Schreiben, in Jena am 30. Oktober 1756 verfasst, setzt sich mit der am 15. Oktober 1756 durch den Geschäftsträger Preußens von der Hellen an die Generalstaaten übergebenen „Réponse du sr. de Hellen ministre du Roi auprès des Etats Généraux Au Memoire que le sr. de Cauderbach résident des Saxe a remis à leurs Hautes Puissances en date du 29 septembre 1756“ auseinander.  ",
KnF_1756-13,1756,"Flugschrift,Replik,Sachsen,Rechtsfrage,Staatsschrift,Pro Memoria",7,[Johann Georg von Ponickau],1756,Chur-Sächsisches Gegen-Pro Memoria auf die Königl. Preußische Erklärung de dato 4. Octobris 1756. Den Einfall in die Chur-Sächsischen Lande betreffend.,"8 Seiten, Druck unvollständig","Reaktion auf: „Pro Memoria. Regensburg, 4. October 1756 – Sr. Königlichen Majestät in Preussen an alle Dero Höchst- und Hohe Mitstände des Reichs abgelassene Circulare. 1756. – Königlich preussisches Circularrescript de dato den 5. October 1756.“ Beschwerde des sächsischen Gesandten beim Reichstag über den Einmarsch Preußens und dessen feindlichen Verhaltens in Sachsen sowie Bitte um schnelle Unterstützung durch die anderen Reichsstände mit dem Ziel der Restitution und Entschädigung des Landes;  Zurückweisung der im Pro-Memoria vom 4. Oktober 1756 erhobenen und bisher nicht belegten Vorwürfe Preußens, auf deren Basis der Einmarsch erfolgte; Betonung der eigenen Friedfertigkeit und Vertragstreue; Preußen bricht den Reichsfrieden und leugnet sein gegen das Natur- und Völkerrecht verstoßendes Verhalten in Sachsen; der Einmarsch verletzt die Grundsätze des Reiches und dessen Gesetze, v. a. die des Landfriedens und des Westfälischen Friedens; Friedrich II. zur Einhaltung dieser Gesetze zu zwingen ist im Interesse aller Reichsstände, sonst droht ihnen ein Schicksal wie Sachsen; Friedrich bedroht also die reichsständischen Freiheiten und kann sich nicht – wie im Pro-Memoria geschehen –  als Verteidiger dieser und der sich aus diesen ergebenden profanen wie religiösen Rechte bezeichnen.",
KnF_1756-14,1756,"Flugschrift,Predigt,Preußen",19,,"Dresden, 1756","Predigt, über das ordentliche Evangelium am drey und zwanzigsten Sonntage nach Trinitatis, welche in höchster Gegenwart Sr. Königlichen Majestät in Preussen, in der Kreuz-Kirche zu Dreßden am 21sten Novembr. 1756. gehalten, und, auf höchstgedachter Seiner Königlichen Majestät ausdrückliches allergnädigstes Verlangen, dem Druck übergeben worden / von D. Johann Joachim Gottlob am Ende, Pfarrern und Superint. auch des Ober-Consistorii Assessorn daselbst.",20 Seiten,"Gedanken in der am 21. November 1756 durch den Superintendenten J. J. G. am Ende in
der Dresdner Kreuzkirche in Anwesenheit Friedrichs II. gehaltenen Predigt zum Thema „suum cuique“: Verpflichtungen, die sich daraus gegenüber Gott,
der Obrigkeit, den Mitmenschen, den irdischen Dingen und dem eigenen
Seelenheil ergeben; Erfüllung dieser Verpflichtungen führt zu Gerechtigkeit, Wohlstand und Gottes Schutz; jeder Untertan schuldet seiner Obrigkeit Gehorsam, diese ihm dafür Schutz; Bestandteil der Pflichten aller, v. a. aber von Herrschern: gegenüber dem Feind Gerechtigkeit und Großmut; Bitte um den Beistand Gottes für Sachsen, Kurfürst Friedrich August II. von Sachsen und dessen Familie sowie für Friedrich II.
",
KnF_1756-15,1756,"Flugschrift,Preußen,Sachsen,Rechtsfrage,Kriegsschuldfrage,Polen",7,"[Hertzberg, Ewald Friedrich von]","ohne Impressum, [1756]",Betrachtungen über das von der Republik Pohlen bey gegenwärtigen Zeitläuften zu haltende Betragen.,8 Seiten,"Erwartung der Neutralität Polens, sowohl hinsichtlich des preußischen Einmarsches in Sachsen als auch des Bündnisses zwischen Rußland und Österreich mit Verweis auf die polnisch-preußische Geschichte („Freundschaft“), gemeinsame Interessen und Gefahren für Polen im Falle der Teilnahme an einem Krieg; Einmarsch richtet sich nur gegen Sachsen; Verbindung Polens als Wahlmonarchie und Republik mit Sachsen nur durch die temporäre Personalunion des gemeinsamen Herrschers; schon aus machtpolitischen Gründen ist die Politik Preußens auf den Erhalt der Unabhängigkeit Polens gerichtet; diese würde durch eine Beteiligung Polens an der Allianz zwischen Rußland und Österreich gefährdet, wie die früheren, jetzt im Besitz der Habsburger befindlichen Wahlmonarchien Böhmen und Ungarn zeigen; deshalb sollte Polen sich nicht durch antipreußische Flugschriften aufhetzen lassen.",
KnF_1756-16,1756,"Flugschrift,Replik,Rechtsfrage,Preußen,Österreich,Streitschrift,Kriegsschuldfrage,Reich,Sachsen,Geschichte als Argument",35,,"Wien, Prag: Trattner, 1756","Die Beantwortung Des, unter dem Titul: Ursachen, welche Seine Königliche Majestät in Preussen bewogen, Sich wider die Absichten des Wienerischen Hofes zu setzen, und deren Ausführung vorzukommen, kund gewordenen Kriegs-Manifests.",36 Seiten,"Österreichische Replik auf  „Exposé des motifs, qui ont obligé Sa Majesté le Roi de Prusse, á prevénir less desseins de la cour de Vienne.“ / deutsch: „Ursachen welche Se. Königl. Maj. in Preussen bewogen, Sich wider die Absichten des Wienerschen Hoffes zu setzen, und deren Ausführung vorzukommen.“ aus dem Oktober 1756; gegen Friedrich als „Friedens-Stöhrer“ sollen „Bundes-Genossen“, „andere Mächte“, v. a. aber die „Reichs-Mit-Stände“ Österreich entsprechend der Reichsverfassung und zum Schutz ihrer eigenen Freiheit unterstützen. Friedrich mißachtet das Völkerrecht, will nicht die Religion schützen, haßt Österreich, weil es das Reich  beschirmt, und ist von Herrschsucht und dem Wunsch nach Vergrößerung Preußens getrieben. Mit der erzwungenen Öffnung des Dresdner Kabinettsarchives habe er nur versucht, seine Intrigen zu verschleiern. Österreich bedrohe Preußen nicht, sondern verteidige sich rechtmäßig. Friedrich verhält sich wortbrüchig, unköniglich und undankbar, da er vergesse, wie sich Maria Theresias Vater für ihn bei seinem Vater eingesetzt habe.",
KnF_1756-17,1756,"Flugschrift,Streitschrift,Replik,Rechtsfrage,Kriegsschuldfrage,Preußen,Österreich,Geschichte als Argument,Sachsen,Reich",7,,"Wien, Prag, 1756","Beantwortung des, unter dem Titul: Ursachen, welche Se. Königl. Majestät in Preussen bewogen, sich wider die Absichten des Wienerischen Hofes zu setzen, und deren Ausführung vorzukommen, kund gewordenen Kriegs-Manifests.",8 Seiten,"Österreichische Replik auf  „Exposé des motifs, qui ont obligé Sa Majesté le Roi de Prusse, á prevénir less desseins de la cour de Vienne.“ / deutsch: „Ursachen welche Se. Königl. Maj. in Preussen bewogen, Sich wider die Absichten des Wienerschen Hoffes zu setzen, und deren Ausführung vorzukommen.“ aus dem Oktober 1756; gegen Friedrich als „Friedens-Stöhrer“ sollen „Bundes-Genossen“, „andere Mächte“, v. a. aber die „Reichs-Mit-Stände“ Österreich entsprechend der Reichsverfassung und zum Schutz ihrer eigenen Freiheit unterstützen. Friedrich mißachtet das Völkerrecht, will nicht die Religion schützen, haßt Österreich, weil es das Reich  beschirmt, und ist von Herrschsucht und dem Wunsch nach Vergrößerung Preußens getrieben. Mit der erzwungenen Öffnung des Dresdner Kabinettsarchives habe er nur versucht, seine Intrigen zu verschleiern. Österreich bedrohe Preußen nicht, sondern verteidige sich rechtmäßig. Friedrich verhält sich wortbrüchig, unköniglich und undankbar, da er vergesse, wie sich Maria Theresias Vater für ihn bei seinem Vater eingesetzt habe.",
KnF_1756-18,1756,"Flugschrift,Staatsschrift",4,,"Frankfurt, Leipzig, 1756",Vollständige Sammlung aller derjenigen Staats-Schriften welche aus Gelegenheit des in Teutschland ausgebrochenen Krieges von denen hierbey intereßirten Hohen Machten publicirt worden: In vier Classen abgetheilt.,2 Blatt,Verzeichnis von Staats- und Streitschriften.,
KnF_1756-19,1756,"Flugschrift,Preußen,Sachsen,Rechtsfrage,Kriegsschuldfrage,Dokumentenanhang,Präventivkrieg",77,"[Hertzberg, Ewald Friedrich von]","Berlin, 1756","Mémoire Raisonné Sur La Conduite Des Cours De Vienne Et De Saxe, Sur Leurs Desseins Dangereux Contre Sa Majesté Le Roi De Prusse, Avec Les Piéces Originales Et Justificatives Qui En Fournissent Les Preuves.","33 Seiten, 40 Seiten","Legitimierung des Friedensbruchs Friedrichs II.; der Krieg wäre ihm aufgezwungen; das Traktat zwischen Österreich und Russland ist wegen der geheimen Klausel nicht als Defensiv-, sondern als Offensivallianz anzusehen; revisionistische Tendenzen hinsichtlich Schlesiens aufseiten Maria Theresias; Teilhabe Sachsens an den Plänen gegen Preußen; Beweise anhand interner Korrespondenz des sächsischen Hofes; Desinformationskampagne der österreichischen und sächsischen Minister mit dem Ziel, Rußland gegen Preußen einzunehmen.","Beilagen:
1. Traité de partage eventuel du 18 May, 1745; 2. Traduction du quatriême Article séparé & secret du Traité de Pétersbourg, du 22 May, 1746.; 3. Résolutions et Instructions pour le Comte de Vicedom, et le Sr. de Pézold à St. Petersbourg; 4. Traduction du mémoire presenté par les Ministres de Saxe à Pétersbourg le 14/25 Sept. 1747; 5. Dépêche du Roi de Pologne au C. de Loos, à Vienne du 21. Dec. 1747; 6. Extrait de l’avis du conseil privé, de Sa Majesté Polonaise, au sujet de l’accession au traité de Pétersbourg, donné le 15 Aout. 1747; 7. Extrait de l’avis du conseil privé de Sa Majesté Polonaise, du 17 Sept. 1748; 8. Extrait d’une Apostille du Comte de Brühl, au Comte de Looss à Paris, de Dresde le 12 Juin, 1747; 9. Déclaration du Comte de Loos, au Ministère de France 1747; 10. Extrait de l’instruction du Général d’Arnim, pour Sa Mission de Pétersbourg, datée le 19 Fevr. 1750; 11. Mémoire remis au Ministre de Russie Comte de Kayserling, à Dresde le 26 Juin, 1756; 12. Extrait d’une lettre du Comte de Flemming, au Comte de Brühl, de Vienne du 28 Fevr. 1753; 13. Extrait de la lettre du Comte de Brühl au Comte de Flemming à Vienne, de Dresde, le 8 Mars 1753; 14. Extrait d’une depêche du Comte de Vicedom au Comte de Brühl, de St. Pétersbourg, le 18 Avril 1747; 15. Traduction de la lettre du Sécrétaire d’Ambassade de Weingarten au Comte d’Uhlefeld. Berlin, du 24 Aout. 1748; 16. Lettre du Comte de Bernes au Comte de la Puebla, datée de Petersbourg le 12. Dec. 1749; 17. Extrait de l’instruction donnée au Général d’Arnim. Dresde le 19 Fevr. 1750. Traduit.; 18. Extrait d’une lettre du Sr. de Funck, au Comte de Brühl, datée de St. Petersbourg le 6 Dec. 1753. Traduit.; 19. Extrait de la Dépêche du Comte de Brühl au Sr. Funck à Pétersbourg le 6 Fevr. 1754. Traduit. [und] Extrait de la lettre du Sr. Funck au Comte de Brühl, du 31 Juin 1754.; 20. Extrait de la Dépêche du Comte de Brühl au Sr. Funck; de Varsovie le 28 Juillet 1754. Traduit.; 21. Extrait de la Dépêche du Comte de Brühl au Sr. Funck; de Varsovie le 2 Aout. 1754. Traduit.; 22. Extrait d’une Dépêche du Comte de Brühl au Sr. Funck au 1 Dec. 1754. Traduit.; 23. Extrait d’une lettre du Sr. Funck au Comte de Brühl; de Pétersbourg, le 9 Juin. 1755. Traduit.; 24. Extrait de la Dépêche du Comte de Brühl à Mr. de Funck; du 23 Juillet 1755. Traduit.; 25. Extrait de la lettre du Sr. Funck, au Comte de Brühl; de Pétersbourg, le 20 Oct. 1755.; 26. Extrait de la Dépêche du Comte de Brühl au Sécretaire Prasse à Pétersbourg; du 2 Juin, 1756.; 27. Extrait de la lettre du Comte de Flemming, au Comte de Brühl; de Vienne, le Juin 1756.; 28. Lettre du Comte de Flemming au Comte de Brühl[,] Vienne ce 28 Juillet 1756.; 29. A Mr. Le Comte de Flemming à Vienne[,] Dresde le 1 Juillet 1756."
KnF_1756-2,1756,"Flugschrift,Staatsschrift,Dokumentenanhang,Bündnissystem",7,,"Wien, Prag: Trattner, 1756","Acta Publica, oder Sammlung aller Staatsschriften, welche seit denen im Jahre 1756 zu London und Versailles geschlossenen Allianz-Tractaten an das Licht gekommen sind und noch kommen werden. Erster Theil.",4 Blatt,Buchdrucker Trattner erhält das Privilegium für eine Edition der Staatsdrucke; Bedingungen des Privilegs; im Vorwort Hervorhebung der Authentizität und Objektivität; Wichtigkeit der Zugänglichkeit von Staatsschriften.,
KnF_1756-20,1756,"Flugschrift,Präventivkrieg,Preußen,Sachsen,Rechtsfrage,Kriegsschuldfrage,Dokumentenanhang",79,"[Hertzberg, Ewald Friedrich von]","M. D. CC. LVI, 1756","Memoire Raisonné Sur La Conduite Des Cours De Vienne Et De Saxe, Et Sur Leurs Desseins Dangereux Contre Sa Majesté Le Roi De Prusse, Avec Les Pieces Originales Et Justificatives Qui En Fournissent Les Preuves.","44 Seiten, 36 Seiten","Legitimierung des Friedensbruchs Friedrichs II.; der Krieg wäre ihm aufgezwungen; das Traktat zwischen Österreich und Russland ist wegen der geheimen Klausel nicht als Defensiv-, sondern als Offensivallianz anzusehen; revisionistische Tendenzen hinsichtlich Schlesiens aufseiten Maria Theresias; Teilhabe Sachsens an den Plänen gegen Preußen; Beweise anhand interner Korrespondenz des sächsischen Hofes; Desinformationskampagne der österreichischen und sächsischen Minister mit dem Ziel, Rußland gegen Preußen einzunehmen.","1. Traité de partage eventuel du 18 May, 1745; 2. Traduction du quatrieme Article separé & secret du Traité de Pétersbourg du 22 May, 1746.; 3. Resolutions et Instructions pour le Comte de Vitzdom, et le Sr. de Pezold a St. Petersbourg; 4. Traduction du memoire presenté par les Ministres de Saxe à Petersbourg le 14/25 Sept. 1747.; 5. Depeche du Roi de Pologne au C. de Loss a Vienne. du 21. Dec. 1747.; 6. Extrait de l’avis du conseil privé, de Sa Majesté Polonaise, au sujet de l’accession au traité de Petersbourg, donné le 15 Aout. 1747; 7. Extrait de l’avis du conseil privé de Sa Majesté Polonaise, du 17 Sept. 1748; 8. Extrait d’une Apostille du Comte de Bruhl, au Comte de Loss, a Paris, de Dresde le 12 Juin, 1747; 9. Declaration du Comte de Loss, au Ministere de France 1747; 10. Extrait de l’instruction du General d’Arnim, pour Sa Mission de Petersbourg, datée le 19 Fevr. 1750; 11. Memoire remis au Ministre de Russie Comte de Keyserling, à Dresde le 26 Juin, 1756; 12. Extrait d’une lettre du Comte de Flemming, au Comte de Bruhl, de Vienne du 28 Fevr. 1753; 13. Extrait de la lettre du Comte de Bruhl au Comte de Flemming a Vienne, de Dresde, le 8 Mars 1753; 14. Extrait d’une depeche du Comte de Vitzdom au Comte de Brühl, de St. Petersbourg, le 18 Avril 1747; 15. Traduction de la lettre du Secretaire d’Ambassade de Weingarten au Comte d’Uhlefeld. Berlin du 24 Aout. 1748; 16. Lettre du Comte de Bernes au Comte de la Puebla, datée de Petersbourg le 12. Dec. 1749; 17. Extrait de l’instruction donnée au General d’Arnim. Dresde le 19 Fevr. 1750. Traduit.; 18. Extrait d’une lettre du Sr de Funck, au Comte de Bruhl, datée de St. Petersbourg le 6 Dec. 1753. Traduit.; 19. Extrait de la Depeche du Comte de Bruhl au Sr. Funck a Petersbourg le 6 Fevr. 1754. Traduit. [und] Extrait de la lettre du Sr. Funck au Comte de Bruhl, du 31 Juin 1754.; 20. Extrait de la Depeche du Comte de Bruhl au Sr. Funck; de Varsovie le 28 Juillet 1754. Traduit.; 21. Extrait de la Depeche du Comte de Bruhl au Sr. Funck; de Varsovie le 2 Aout. 1754. Traduit.; 22. Extrait d’une Depeche du Comte de Bruhl au Sr. Funck, du 1 Dec. 1754. Traduit.; 23. Extrait d’une lettre du Sr. Funck au Comte de Bruhl; de Petersbourg le 9 Juin. 1755. Traduit.; 24. Extrait de la Depeche du Comte de Bruhl a Mr. de Funck; du 23 Juillet 1755. Traduit.; 25. Extrait de la lettre du Sr. Funck au Comte de Bruhl, de Petersbourg le 20 Oct. 1755.; 26. Extrait de la Depeche du Comte de Bruhl au Secretaire Prasse a Petersbourg, du 2 Juin, 1756.; 27. Extrait de la lettre du Comte de Flemming au Comte de Bruhl, de Vienne, le Juin 1756.; 28. Lettre du Comte de Flemming au Comte de Bruhl[,] Vienne ce 28 Juillet 1756.; 29. A Mr. Le Comte de Flemming a Vienne[,] Dresde le 1 Juillet 1756."
KnF_1756-21,1756,"Flugschrift,Reskript,Dokumentenanhang,Rechtsfrage,Preußen,Staatsschrift",3,"[Hertzberg, Ewald Friedrich von]",1756,Das von Sr. Königl. Majestät in Preussen an Dero Ministros erlassenes allergnädigstes Circular-Rescript d. d. Berlin den 18. Septembris 1756. Nebst angefügtem Kriegs-Manifest.,2 Blatt,"Kurze Legitimation des preußischen Einmarsches in Sachsen als Schutzmaßnahme (Prävention) für die eigenen Territorien, im Interesse der reichsständischen Freiheiten und allgemein des „teutschen Vaterlandes“; Bedrohung durch Wiener und Dresdner Hof und deren v. a. auf die Schwächung Preußens gerichtete Politik; Maria Theresia wartet nur auf günstige Gelegenheit zum Krieg, durch die Verweigerung einer friedlichen Verständigung ist militärische Reaktion unumgänglich, Wiener Hof trägt die Verantwortung für das folgende Blutvergießen; Ankündigung der Veröffentlichung von sächsischen Dokumenten, die die zunächst nur auf Vermutungen beruhenden Vorwürfe belegen; schon jetzt zeugt das stark befestigte Lager des sächsischen Armee in Pirna deren Kriegsvorbereitungen.",
KnF_1756-22,1756,"Flugschrift,Rechtsfrage,Replik,Österreich,Dokumentenanhang,Streitschrift",7,"[Podewils, Heinrich von], [Müller, Georg Friedrich]","Berlin: Henning, 1756","Kurtze Abfertigung der sogenannten Beantwortung des Wienerschen Hofes auf das Königlich Preußische Manifest. / [Podewils, Heinrich von] 1756",8 Seiten,"Reaktion auf die „Beantwortung des, unter dem Titul: Ursachen, welche Se. Königl. Majestät in Preußen erwogen, sich wider die Absichten des Wienerschen Hofes zu setzen und deren Ausführung zuvor zu kommen, kundgewordenen Krieges-Manifest“ mit Verweisen auf das „Memoire raisonné“ und die dort veröffentlichten Dokumente aus dem Dresdner Kabinett; Zurückweisung aller Vorwürfe Österreichs, die mit vielmehr Recht allesamt gegen das Erzhauses erhoben werden können (Beginn der Rüstungen, Eroberungssucht im Reich und Ausland, Anstiftung zu Unruhen, Streben nach der Vorherrschaft im Reich unter Ausnutzung der Reichsinstitutionen, Bedrohung des corpus evangelicorum, Bestechung vereidigter Personen); im Zentrum der Schrift: Widerlegung des Vorwurfs, dass man die Beweise für die Legitimität des Einmarsches in Sachsen erst in nach diesem in Dresden suchen musste und es sich somit um eine Aggression handelte sowie Begründung für die spätere Publikation der Originale und den Verzicht auf die Veröffentlichung der bereits vorher in preußischen Besitz befindlichen Abschriften.","Beilage:
1. Antwort des Königl. Preußischen Cabinets-Ministerii, auf das, von dem Römisch-Kayserl. und Königl. Ungar- und Böhmischen General-Feldmarschall-Lieutenant und bevollmächtigten Minister, Grafen von Puebla, unter dem 15ten Junii eingereichtes Pro Memoria, die Ausfündigmachung, Inhaftirung und Auslieferung des von der Kayserl. Königlichen Gesandtschaft entwichenen Secretarii von Weingarten des jüngern betreffend. d. d. Berlin den 24. Junii 1756
2. Königliche Cabinets-Ordre. An den Magistrat zu Stendal, wegen Inhaftirung gedachten Gesandschafts-Secretarii von Weingarten d. d. Potsdam, den 19ten Junii 1756"
KnF_1756-23,1756,"Flugschrift,Brief,Dokumentenanhang,Rechtsfrage,Preußen,Österreich,Sachsen,Bündnissystem,Geschichte als Argument,Streitschrift",19,,"Straßburg, 1756",Sendschreiben unterm 6ten November 1756. Das Memoire Raisonne und die zu desssen Beweiß dienende Urkunden betreffend.,20 Seiten,"Anonymer Autor; Text vorgeblich verfasst in Straßburg, 6. Dezember 1756; Preußen ist der Angreifer und Friedensbrecher, da es weder von Österreich und Rußland noch Sachsen bedroht wurde; Anlass zum Schreiben: ""Memoire pour justifier la conduite du Roi de Prusse contre les fausses impulations de la Cour de Saxe."" Auseinandersetzung im Text erfolgt aber mit dem „Memoire Raisonné Sur La Conduite Des Cours De Vienne Et De Saxe, Et Sur Leurs Desseins Dangereux Contre Sa Majesté Le Roi De Prusse [...]“ und den in diesem veröffentlichten Dokumenten; 
2 Schwerpunkte: 
1. Wertung und Interpretation der Kopien und der durch die Öffnung des Dresdner Kabinettsarchives im Zuge des preußischen Einmarsches erbeuteten Originale des Schriftwechsels der sächsischen Minister und Diplomaten 
2. Einschätzung der Bündnisbestrebungen des Wiener, des Moskauer und des sächsischen Hofes und des Petersburger Vertrags (1746) als Defensivvertrag; 
Kopien und Originale können den preußischen Einmarsch in Sachsen nicht legitimieren; Zweifel am Wahrheitsgehalt der Kopien aus der Hand von wenig vertrauenswürdigen („meyneidigen“) Personen sowie am Zeitpunkt, an dem diese in die Hände Friedrichs kamen, da er seine Vorwürfe gegen Sachsen erst nach erfolgten Einmarsch erhebt; letzteres gilt auch für die Originale; diese belegen vielmehr die auf Schutz vor Preußen ausgerichtete Politik; kein Verstoß gegen die im Dresdner Frieden (1745) zwischen Preußen, Sachsen und Österreich beschworene Freundschaft; dem Petersburger Vertrag (1746) liegen Schutzbestrebungen zugrunde, deshalb handelt es sich um ein Defensivbündnis; dem widersprechen auch die Geheimen Artikel nicht, alle Vereinbarungen werden erst im Falle eines Angriffs durch Preußen wirksam; auch die Besetzung von dessen Provinzen ist nach Völkerrecht in diesem Fall legitim, wie auch Beispiele aus der  brandenburgischen Geschichte zeigen; für das Bündnis musste der Wiener Hof die Zarin nicht gegen Preußen aufhetzen, die Furcht vor Friedrich beruht auf dessen expansiver Politik; Sachsen ist dem Petersburger Vertrag nicht beigetreten;
Inhalt und Ton der vom preußischen König von Maria Theresia geforderten Sicherheiten.",
