id,year,keywords,imagenum,_verfasser,_ort,_titel,_umfang,_inhalt,_beilagen
KnF_1756-39,1756,"Flugschrift,Dokumentenanhang,Preußen,Sachsen,Rechtsfrage,Kriegsschuldfrage,Präventivkrieg",70,,"Amsterdam: Changuion, 1756",Memoire Raisonné Sur La Conduite Des Cours De Vienne Et De Saxe. Sur Leurs Desseins Dangereux Contre Sa Majeste Le Roi De Prusse. Avec Les Pieces Originales Et Justificatives Qui En Fournissent Les Preuves.,"24 Seiten, 56 Seiten, 16 Seiten","Legitimierung des Friedensbruchs Friedrichs II.; der Krieg wäre ihm aufgezwungen; das Traktat zwischen Österreich und Russland ist wegen der geheimen Klausel nicht als Defensiv-, sondern als Offensivallianz anzusehen; revisionistische Tendenzen hinsichtlich Schlesiens aufseiten Maria Theresias; Teilhabe Sachsens an den Plänen gegen Preußen; Beweise anhand interner Korrespondenz des sächsischen Hofes; Desinformationskampagne der österreichischen und sächsischen Minister mit dem Ziel, Rußland gegen Preußen einzunehmen.","1. Traité de partage éventuel du 18 May, 1745; 2. Traduction du quatrieme Article separé et secret du Traité de Petersbourg du 22 May, 1746.; 3. Resolutions et Instructions pour le Comte de Vicedom, et le Sr. de Pezold a St. Petersbourg; 4. Traduction du memoire presenté par les Ministres de Saxe a Petersbourg le 14/25 Sept. 1747.; 5. Depeche du Roi de Pologne au C. de Loos a Vienne. du 21. Dec. 1747.; 6. Extrait de l’avis du conseil privé, de Sa Majesté Polonaise, au sujet de l’accession au traité de Petersbourg, donné le 15 Aout. 1747; 7. Extrait de l’avis du conseil privé de Sa Majesté Polonaise, du 17 Sept. 1748; 8. Extrait d’une Apostille du Comte de Bruhl, au Comte de Loss, a Paris, de Dresde le 12 Juin, 1747; 9. Declaration du Comte de Looss, au Ministere de France 1747; 10. Extrait de l’instruction du General d’Arnim, pour Sa Mission de Petersbourg, datée le 19 Fevr. 1750; 11. Memoire remis au Ministre de Russie Comte de Kayserling, a Dresde le 26 Juin, 1756; 12. Extrait d’une lettre du Comte de Flemming, au Comte de Bruhl, de Vienne du 28 Fevr. 1753; 13. Extrait de la lettre du Comve de Bruhl au Comte de Flemming a Vienne, de Dresde, le 8 Mars 1753; 14. Extrait d’une depeche du Comte de Vicedom au Comte de Bruhl, de St. Petersbourg, le 18 Avril 1747; 15. Traduction de la lettre du Secretaire d’Ambassade de Weingarten au Comte d’Uhlefeld. Berlin du 24 Aout. 1748; 16. Lettre du Comte de Bernes au Comte de la Puebla, datée de Petersbourg le 12. Dec. 1749; 17. Extrait de l’instruction donnée au General d’Arnim. Dresde le 19 Fevr. 1750. Traduit.; 18. Extrait d’une lettre du Sr. de Funck, au Comte de Bruhl, datée de St. Petersbourg le 6 Dec. 1753. Traduit.; 19. Extrait de la Depeche du Comte de Bruhl au Sr. Funck a Petersbourg, le 6 Fevr. 1754. Traduit. [und] Extrait de la lettre du Sr. Funck au Comte de Brulh, du 31 Juin 1754.; 20. Extrait de la Depeche du Comte de Bruhl au Sr. Funck, de Varsovie le 28 Juillet 1754. Traduit.; 21. Extrait de la Depeche du Comte de Bruhl au Sr Funck, de Varsovie, le 2 Aout. 1754. Traduit.; 22. Extrait d’une Depeche du Comte de Bruhl au. Sr. Funck, du 1 Dec. 1754. Traduit.; 23. Extrait d’une lettre du Sr. Funck au Comte de Bruhl de Petersbourg le 9 Juin. 1755. Traduit.; 24. Extrait de la Depeche du Comte de Bruhl a Mr. de Funck, du 23 Juillet 1755. Traduit.; 25. Extrait de la lettre du Sr. Funck, au Comte de Bruhl, de Petersbourg, le 20 Oct. 1755.; 26. Extrait de la Depeche du Comte de Bruhl au Secretaire Prasse a Petersbourg, du 2 Juin, 1756.; 27. Extrait de la lettre du Comte de Flemming, au Comte de Bruhl, de Vienne, le Juin 1756.; 28. Lettre du Comte de Flemming au Comte de Bruhl[,] Vienne ce 28 Juillet 1756.; 29. A Mr. Le Comte de Flemming a Vienne[,] Dresde le 1 Juillet 1756."
KnF_1756-4,1756,"Flugschrift,Reskript,Preußen,Rechtsfrage,Kriegsschuldfrage,Präventivkrieg,Reichsverfassung,Sachsen,Staatsschrift",19,"[Friedrich II., König von Preußen]","Wien, Prag: Trattner, 1756","Rescript Sr. königl. Majestät in Preußen an dero wirklich Geheimbden-Staats- und Bevollmächtigten Ministre auf dem Reichs-Tage zu Regensburg, Freyherrn von Plotho, d. d. Berlin den 18. Octob. 1756. in Antwort auf dasjenige Circulare, welches die Kaiserin Königin an dero Ministres an auswärtigen Höfen unter dem 20sten September ergehen lassen. Nach dem Berliner Exemplar, 1756",19 Seiten,Friedrichs II. Reaktion auf das Zirkularreskript Maria Theresias; Zurückweisung des Friedensstörungsvorwurfes; der Einfall in Sachsen war ein Präventivkrieg; Legitimierung des Vorgangs bei der Besetzung Sachsens.,
KnF_1756-40,1756,"Flugschrift,Preußen,Rechtsfrage,Kriegsschuldfrage,Sachsen,Präventivkrieg",7,,"Wien, Prag: Trattner, [1756]",Memoire zur Rechtfertigung des Verfahrens des Königs in Preußen gegen die falschen Beschuldigungen des Sächsischen Hofes. Aus dem Französischen Berliner Exemplar ins Deutsche übersetzt.,8 Seiten,"Verteidigung des preußischen Einmarsches in Sachsen als „gerechte“ Schutzmaßnahme (der eigenen Länder und der eigenen Armee) sowie Zurückweisung aller Vorwürfe hinsichtlich des Umgangs mit dem sächsischen Kurfürsten, dessen Familie und wegen der Öffnung des Kabinetts in Dresden; Ziel Preußens ist die „Versicherung“ der kursächsischen Lande und der sächsischen Armee, ohne Absicht zur Eroberung; Rückgabe des kursächsischen  Territoriums, wenn sich der Kurfürst „erklärt“; Betonung der Achtung gegenüber dem Kurfürsten und dessen Familie; Friedrich sieht sich durch seine Erfahrungen mit dem Verhalten Sachsens im 2. Schlesischen Krieg, der Kenntnis des Leipziger Teilungsvertrages (1745) sowie der gegen den Dresdner Frieden (1745) gerichteten Politik Sachsens zu seinem Vorgehen berechtigt; Sachsen verfolgt unter vorgeblicher Neutralität feindliche Absichten, indem es die im Leipziger Teilungstraktat in Aussicht gestellten Eroberungen zur Grundlage der Beteiligung am Petersburger Vertrag macht; Gefahr geht v. a. vom sächsischen Minister Brühl, der den sächsischen Kurfürsten falsch berät, und von der Unterstützung für derartige Bestrebungen durch den Wiener Hof aus; Friedrich war über die Pläne bereits vor dem Einmarsch durch Abschriften der Korrespondenz sächsischer Würdenträger informiert; nur die entsprechenden Originale wurden dem Dresdner Kabinetts entnommen; der Einmarsch erbrachte neben den Beweisen anhand dieser Dokumente weitere Belege für die feindlichen Absichten Sachsens.",
KnF_1756-41,1756,"Flugschrift,Präventivkrieg,Preußen,Sachsen,Rechtsfrage,Kriegsschuldfrage,Dokumentenanhang",75,,"Berlin, 1756","Memoire Raisonné Svr La Condvite Des Cours De Vienné Et De Saxe, Et Sur Leurs Desseins Dangereux Contre Sa Majesté Le Roi De Prusse, Avec Les Pieces Originales Et Justificatives Qui En Fournissent Les Preuves.","40 Seiten, 36 Seiten","Legitimierung des Friedensbruchs Friedrichs II.; der Krieg wäre ihm aufgezwungen; das Traktat zwischen Österreich und Russland ist wegen der geheimen Klausel nicht als Defensiv-, sondern als Offensivallianz anzusehen; revisionistische Tendenzen hinsichtlich Schlesiens aufseiten Maria Theresias; Teilhabe Sachsens an den Plänen gegen Preußen; Beweise anhand interner Korrespondenz des sächsischen Hofes; Desinformationskampagne der österreichischen und sächsischen Minister mit dem Ziel, Rußland gegen Preußen einzunehmen.","1. Traité de partage éventuel du 18 May, 1745; 2. Traduction du quatrieme Article separé et secret du Traité de Petersbourg du 22 May, 1746.; 3. Resolutions et Instructions pour le Comte de Vicedom, et le Sr. de Pezold a St. Petersbourg; 4. Traduction du memoire presenté par les Ministres de Saxe à Petersbourg le 14/25 Sept. 1747.; 5. Depeche du Roi de Pologne au C. de Loos. A Vienne. du 21. Dec. 1747.; 6. Extrait de l’avis du conseil privé, de Sa Majesté Polonaise, au sujet de l’accession au traité de Petersbourg, donné le 15 Aout. 1747; 7. Extrait de l’avis du conseil privé de Sa Majesté Polonaise, du 17 Sept. 1748; 8. Extrait d’une Apostille du Comte de Brühl, au Comte de Loss, a Paris, de Dresde le 12 Juin, 1747; 9. Declaration du Comte de Looss, au Ministere de France 1747; 10. Extrait de l’instruction du General d’Arnim, pour sa Mission de Petersbourg, datée le 19 Fevr. 1750; 11. Memoire remis au Ministre de Russie Comte de Kayserling, a Dresde le 26 Juin, 1756; 12. Extrait d’une lettre du Comte de Flemming, au Comte de Brühl, de Vienne du 28 Fevr. 1753; 13. Extrait de la lettre du Comte de Brühl au Comte de Flemming a Vienne, de Dresde, le 8 Mars 1753; 14. Extrait d’une depeche du Comte de Vicedom au Comte de Brühl, de St. Petersbourg, le 18 Avril 1747; 15. Traduction de la lettre du Secretaire d’Ambassade de Weingarten au Comte d’Uhlefeld. Berlin du 24 Aout. 1748; 16. Lettre du Comte de Bernes au Comte de la Puebla, datée de Petersbourg le 12. Dec. 1749; 17. Extrait de l’instruction donnée au General d’Arnim. Dresde le 19 Fevr. 1750. Traduit.; 18. Extrait d’une lettre du Sr. de Funck, au Comte de Bruhl, datée de St. Petersbourg le 6 Dec. 1753. Traduit.; 19. Extrait de la Depeche du Comte de Bruhl au Sr. Funck a Petersbourg, le 6 Fevr. 1754. Traduit. [und] Extrait de la lettre du Sr. Funck au Comte de Bruhl, du 31 Juin 1754.; 20. Extrait de la Depeche du Comte de Brühl au Sr. Funck, de Varsovie le 28 Juillet 1754. Traduit.; 21. Extrait de la Depeche du Comte de Bruhl au Sr. Funck, de Varsovie, le 2 Aout. 1754. Traduit.; 22. Extrait d’une Depeche du Comte de Bruhl au. Sr. Funcke, du 1 Dec. 1754. Traduit.; 23. Extrait d’une lettre du Sr. Funck au Comte de Brühl de Petersbourg, le 9 Juin. 1755. Traduit.; 24. Extrait de la Depeche du Comte de Brühl a Mr. de Funck, du 23 Juillet 1755. Traduit.; 25. Extrait de la lettre du Sr. Funck, au Comte de Brühl, de Petersbourg, le 20 Oct. 1755.; 26. Extrait de la Depeche du Comte de Brühl au Secretaire Prasse à Petersbourg, du 2 Juin, 1756.; 27. Extrait de la lettre du Comte de Flemming, au Comte de Bruhl, de Vienne, de Juin 1756.; 28. Lettre du Comte de Flemming au Comte de Brühl[,] Vienne ce 28 Juillet 1756.; 29. A Mr. Le Comte de Flemming a Vienne[,] Dresde le 1 Juillet 1756."
KnF_1756-42,1756,"Flugschrift,Dokumentenanhang,Präventivkrieg,Preußen,Sachsen,Rechtsfrage,Kriegsschuldfrage",54,,"Wien, Prag: Trattner, 1756",Gründliche Memoire über die Aufführung des Wienerischen und Sächsischen Hofes und deren gefährliche Absichten wider Seine Königl. Majestät von Preußen mit beygefügten Originalurkunden. Aus dem französischen Exemplar ins deutsche übersetzt.,"24 Seiten, 31 Seiten","Legitimierung des Friedensbruchs Friedrichs II.; der Krieg wäre ihm aufgezwungen; das Traktat zwischen Österreich und Russland ist wegen der geheimen Klausel nicht als Defensiv-, sondern als Offensivallianz anzusehen; revisionistische Tendenzen hinsichtlich Schlesiens aufseiten Maria Theresias; Teilhabe Sachsens an den Plänen gegen Preußen; Beweise anhand interner Korrespondenz des sächsischen Hofes; Desinformationskampagne der österreichischen und sächsischen Minister mit dem Ziel, Rußland gegen Preußen einzunehmen.","1. Eventualer Partage-Tractat vom 18. May 1745; 2. Ubersetzung des vierten geheimen und Separats-Artickels von dem Petersburgischen Tractat d. d. 22. Maji 1746; 3. Resolutiones und Instructiones vor den Grafen von Vizdom und der Herrn von Pezold zu St. Petersburg; 4. Ubersetzung des durch die Chur-Sächsische Ministres den 14/25 Septembr. 1747 zu Petersburg übergebenen Pro-Memoria; 5. Schreiben des Königs von Polen an den Grafen von Loß zu Wien, vom 21. Dec. 1747; 6. Extract aus dem von dem geheimen Consilio Sr. Königlichen Polnischen Majestät wegen des Accession zum Petersburgischen Tractat, den 15. Aug. 1747 abgestatteten Gutachten.; 7. Extract Gutachtens des geheimen Consili Sr. Königl. Polnischen Majest. dd. 17. Sept. 1748; 
8. Extract [des] Schreibens des Grafen von Brühl an den Grafen von Loß zu Paris, d. d. Dreßden den 12. Jun. 1747; 9. Declaration des Grafen von Loß an das Französische Ministerium. 1747; 10. Extract aus der Instruction des Generals d’Arnim, bey seiner Absendung nach Petersburg, d. d. 19. Februar 1750; 11. Pro Memoria, so dem Rußischen Ministre, Grafen von Kaiserling, unterm 26. Junii 1751 übergeben worden; 12. Extract [des] Schreibens des Grafen von Flemming an den Grafen von Brühl, d. d. Wien den 28. Febr. 1753; 13. Extract [des] Schreibens des Grafens von Brühl an den Grafen von Flemming zu Wien, d. d. Dreßden den 8. Martii 1753; 14. Extract [des] Schreibens des Grafens von Vizdom an den Grafen von Brühl d. d. St. Petersburg den 18. April. 1747; 15. Ubersetzung des Schreibens von dem Legations-Secretario Weingarten an den Grafen von Uhlefeld, d. d. Berlin den 24. August 1748; 16. Schreiben des Grafen von Bernes an den Graf de Puebla, d. d. Petersburg den 12. Dec. 1749; 17. Extract der dem General von Arnim ertheilten Instruction, d. d. Dreßden den 19. Febr. 1750; 18. Extract eines Briefes des von Funck an den Grafen von Brühl, d. d. Petersburg den 6. Dec. 1753; 19. Extract [des] Schreibens des Grafen von Brühl an den von Funck zu Petersburg, d. d. 6. Febr. 1754; 20. Extract [des] Schreibens des Grafen von Brühl an den von Funck d. d. Warschau den 28. Jun. 1754; 21. Extract [des] Schreibens des Grafens von Brühl an den von Funck, d. d. Warschau den 2. Augusti 1754; 22. Extract [des] Schreibens des Grafens von Brühl an den von Funck, d. d. 1. Dec. 1754; 23. Extract [des] Schreibens des von Funck an den Grafen von Brühl, d. d. Petersburg den 9. Junii 1755; 24. Extract [des] Schreibens des Grafens von Brühl an den von Funck d. d. 23. Julii 1755; 25. Extract [des] Schreibens des von Funck an den Grafen von Brühl, d. d. Petersburg den 20. Octobr. 1755; 26. Extract [des] Schreibens von dem Grafen von Brühl an den Secretarium Prasse zu Petersburg, d. d. 2. Junii 1756; 27. Extract [des] Schreibens des Grafen von Flemming, an den Graf von Brühl, d. d. Wien de -- Junii 1756; 28. Schreiben des Grafen von Flemming an den Grafen von Bruhl, d. d. Wien den 28. Julii 1756; 29. An den Herrn Grafen von Flemming in Wien, Dreßden den 1. Julii 1756."
KnF_1756-43,1756,"Flugschrift,Preußen,Sachsen,Rechtsfrage",11,,"ohne Impressum, 1756",Rechtfertigung Des Betragens Sr. Königlichen Majestät in Preussen gegen die Höchst-Deroselben von dem Chur-Sächsischen Hofe gemachte falsche Beschuldigungen.,11 Seiten,"Verteidigung des preußischen Einmarsches in Sachsen als „gerechte“ Schutzmaßnahme (der eigenen Länder und der eigenen Armee) sowie Zurückweisung aller Vorwürfe hinsichtlich des Umgangs mit dem sächsischen Kurfürsten, dessen Familie und wegen der Öffnung des Kabinetts in Dresden; Ziel Preußens ist die „Versicherung“ der kursächsischen Lande und der sächsischen Armee, ohne Absicht zur Eroberung; Rückgabe des kursächsischen  Territoriums, wenn sich der Kurfürst „erklärt“; Betonung der Achtung gegenüber dem Kurfürsten und dessen Familie; Friedrich sieht sich durch seine Erfahrungen mit dem Verhalten Sachsens im 2. Schlesischen Krieg, der Kenntnis des Leipziger Teilungsvertrages (1745) sowie der gegen den Dresdner Frieden (1745) gerichteten Politik Sachsens zu seinem Vorgehen berechtigt; Sachsen verfolgt unter vorgeblicher Neutralität feindliche Absichten, indem es die im Leipziger Teilungstraktat in Aussicht gestellten Eroberungen zur Grundlage der Beteiligung am Petersburger Vertrag macht; Gefahr geht v. a. vom sächsischen Minister Brühl, der den sächsischen Kurfürsten falsch berät, und von der Unterstützung für derartige Bestrebungen durch den Wiener Hof aus; Friedrich war über die Pläne bereits vor dem Einmarsch durch Abschriften der Korrespondenz sächsischer Würdenträger informiert; nur die entsprechenden Originale wurden dem Dresdner Kabinetts entnommen; der Einmarsch erbrachte neben den Beweisen anhand dieser Dokumente weitere Belege für die feindlichen Absichten Sachsens.",
KnF_1756-44,1756,Flugschrift,3,,1756,"Declaration Derjenigen Gründe, welche Se. Königl. Maj. in Preussen bewogen, Mit Dero Armee in Sr. Königl. Maj. von Pohlen und Churfürstl. Durchl. zu Sachsen Erb-Lande einzurücken.",,"Allgemein gehaltene Begründung der Notwendigkeit für den Einmarsch in Sachsen und Beteuerung der persönlichen „Freundschaft“ und Hochachtung Friedrichs II. für den König von Polen und Kurfürsten von Sachsen (oder: August III.  / Friedrich August II.) sowie der Versicherung, in Sachsen keine „offensiven“  (Eroberung) Absichten zu verfolgen; die Ablehnung der preußischen Vorschläge zum Ausgleich durch den Wiener Hof ist ungerecht, der Ton seiner Ablehnung anmaßend und seine Pläne zum Nachteil Preußens; deshalb sowie durch die „unglücklichen“ Zeitläufte, durch die „Gesetze des Krieges“ und die Erfahrungen mit Sachsens Verhalten 1744 zwingen (gegen die persönliche Neigung Friedrichs II.) zum Einmarsch; Zusicherung hinsichtlich der Disziplin preußischer Truppen im Kurfürstentum und des Umgangs mit dem Land; soll „als ein depot“ an den Friedrich August II. zurückgegeben werden. ",
KnF_1756-45,1756,Flugschrift,3,,1756,"Verfolg der Reichshofrathlichen Conclusorum, Sabbathi, d. 9. Oct. 1756. Den gewaltsamen Königl. Preußischen, Chur-Brandenburgischen Einfall in die Königl. Pohln.Chur-Sächsischen Chur-Lande, auch weitern Anzug in die Reichs-Lande betreffend.",2 Blatt,"Erneuertes und um neue Tatsachen zum des Landfriedens durch Friedrich II. erweitertes „conclusum“ des Reichshofrates vom 9. Oktober 1756 welcher den König auffordert, den bisherigen kaiserlichen Reskripten Gehorsam zu leisten und seine Verstöße gegen den Landfrieden sofort abzustellen, Schadensersatz und Genugtuung zu leisten; Friedrich II. befindet sich im Status der „Empörung“ gegen Reich und Kaiser, beleidigt dessen „Majestät“, bricht den Landfrieden und bedroht letztlich alle Reichsgrundgesetze und -stände; der König ignoriert die bisherigen Mahnungen und Erinnerungen (Monitoria, Excitatoria, Dehortatoria und Inhibitatoria) des Reichshofrates; stattdessen weitere Rechtsbrüche in Sachsen und Einmarsch in Böhmen; beide haben als Reichsstände Anspruch auf Hilfe; Wiederholung der Forderung nach Einstellung der militärischen Handlungen Preußens, den Rückzug seiner Truppen und die Entschädigung der Opfer; feierliche Erklärung im Namen des Kaisers, da die bisherigen preußischen Veröffentlichungen und Erklärungen Misstrauen und Unruhe geschaffen haben; Forderung an die Kreisausschreibenden Fürsten, Preußen in keiner Form zu unterstützen, die vorherigen avocatoria umzusetzen, gegen „verleumderische und unruhestiftende“ [= preußische] Schriften und deren Verbreitung vorzugehen sowie Maßnahmen für die Unterstützung des Kaisers zur Durchsetzung des Landfriedens einzuleiten.",
KnF_1756-5,1756,"Flugschrift,Österreich,Dokumentenanhang,Sachsen,Kriegsschuldfrage,Rechtsfrage,Bündnissystem,Streitschrift",57,"[Hertzberg, Ewald Friedrich von]","Berlin, 1756",Nachricht und Beurtheilung des verhaltens des Wienerischen und Sächsischen Hofes und ihrer gefährlichen Absichten wider Seine Majestät den König von Preussen nebst den zur Rechtfertigung und Beweis dienenden Urkunden.,"24 Seiten, 32 Seiten","Legitimierung des Friedensbruchs Friedrichs II.; der Krieg wäre ihm aufgezwungen; das Traktat zwischen Österreich und Russland ist wegen der geheimen Klausel nicht als Defensiv-, sondern als Offensivallianz anzusehen; revisionistische Tendenzen hinsichtlich Schlesiens aufseiten Maria Theresias; Teilhabe Sachsens an den Plänen gegen Preußen; Beweise anhand interner Korrespondenz des sächsischen Hofes; Desinformationskampagne der österreichischen und sächsischen Minister mit dem Ziel, Preußen anzuschwärzen.","(Urkunden, welche zur Rechtfertigung dienen können): 1. Künftiger Theilungsvergleich vom 18ten May 1745; 2. Uebersetzung des vierten besondern und geheimen Artikels des Vertrags zu Petersburg den 22sten May 1746; 3. Entschliessungen und Maasregeln für den Graf von Vitzthum und der Hrn. von Petzold zu St. Petersburg; 4. Uebersetzung der von den Sächsischen Ministern den 14/25ten September 1747. zu Petersburg eingegebenen Schrift; 5. Schreiben des Königs von Pohlen an den Graf von Loos nach Wien, den 23ten December 1747; 6. Auszug einer Vorstellung des geheimen Rahts Sr. pohln. Majest. des Beytritts zu dem Petersburgischen Vertrag wegen, gegeben den 15ten August 1747; 7. Auszug einer Vorstellung des geheimen Rahts seiner pohln. Maj. vom 17ten September 1748; 8. Auszug eines Postscripts des Grafen von Brühl an den Grafen von Loos zu Paris, gegeben zu Dresden den 12ten Junius 1747; 9. Des Grafen von Loos dem Französischen Ministerio überreichte Erklärung. 1747; 10. Auszug der Vorschrift des Generals von Arnim seiner Gesandtschaft nach Petersburg wegen, gegeben den 19ten Febr. 1750; 11. Pro Memoria, welches dem Rußeschen Minister, Grafen von Kayserling zugeschickt worden, Dresden den 26ten Junius 1751; 12. Auszug aus einem Schreiben des Grafen von Flemming an den Grafen von Brühl, aus Wien den 28ten Febr. 1753; 13. Auszug eines Schreibens des Grafen von Brühl an den Grafen von Flemming zu Wien, gegeben Dresden den 8ten März 1753; 14. Auszug eines Schreibens des Grafens von Vitzthum an den Grafen von Brühl, von St. Petersburg, den 18ten April 1747;15. Schreiben des Gesandschaftssecretarii von Weingarten an den Grafen von Uhlefeld, Berlin den 24ten August 1748; 16. Schreiben des Grafen von Bernes an den Graf de Puebla, gegeben zu Petersburg den 12ten December 1749; 17. Auszug aus der dem Gen. von Arnim gegebenen Vorschrift, Dresden den 19ten Februarius 1750; 18. Auszug eines Schreibens des Herrn von Funck an den Grafen von Brühl, geschrieben zu St. Petersburg, den 6ten December 1753; 19. Auszug des Schreibens vom Graf Brühl an den Herrn Funck nach Petersburg, vom 6ten Februarius 1754, Auszug aus einem Schreiben des Herrn Funck an den Grafen von Brühl, vom 31sten Junius 1754; 20. Auszug eines Schreibens des Grafen von Brühl an den Herrn Funck aus Warschau, vom 28sten Junius 1754; 21. Auszug des Schreibens des Grafen von Brühl an Herrn Funck aus Warschau, vom 2ten August 1754; 22. Auszug eines Schreibens des Grafen von Brühl an den Herrn Funck, vom 1sten December 1754; 23. Auszug eines Schreibens des Herrn Funck an den Graf von Brühl aus Petersburg, den 9ten Junius 1755; 24. Auszug des Schreibens des Grafen von Brühl an den Herrn von Funck, vom 23sten Julius 1755; 25. Auszug aus dem Schreiben des Herrn Funck an den Graf von Brühl aus Petersburg, vom 20sten October 1755; 26. Auszug aus dem Schreiben des Grafen von Brühl an den Secretaire Prasse zu Petersburg, vom 2ten Junius 1756; 27. Auszug des Schreibens des Grafens von Flemming an den Graf von Brühl, aus Wien im Junius 1756; 28. Wien den 28sten Julius 1756. Schreiben des Grafen von Flemming an den Graf von Brühl; 29. Dresden den 1sten Julius 1756. An den Herrn Grafen von Flemming zu Wien."
KnF_1756-6,1756,"Flugschrift,Replik,Rechtsfrage,Preußen,Reich,Österreich,Streitschrift,Sachsen,Geschichte als Argument",18,,"Wien, Prag: Trattner, 1756","Beantwortung des, unter dem Titul: Ursachen welche Sr. Königl. Majestät in Preußen bewogen sich wider die Absichten des Wienerischen Hofes zu setzen, und deren Ausführung vorzukommen, kund gewordenen Kriegs-Manifests.",19 Seiten,"Österreichische Replik auf  „Exposé des motifs, qui ont obligé Sa Majesté le Roi de Prusse, á prevénir less desseins de la cour de Vienne.“ / deutsch: „Ursachen welche Se. Königl. Maj. in Preussen bewogen, Sich wider die Absichten des Wienerschen Hoffes zu setzen, und deren Ausführung vorzukommen.“ aus dem Oktober 1756; gegen Friedrich als „Friedens-Stöhrer“ sollen „Bundes-Genossen“, „andere Mächte“, v. a. aber die „Reichs-Mit-Stände“ Österreich entsprechend der Reichsverfassung und zum Schutz ihrer eigenen Freiheit unterstützen. Friedrich mißachtet das Völkerrecht, will nicht die Religion schützen, haßt Österreich, weil es das Reich  beschirmt, und ist von Herrschsucht und dem Wunsch nach Vergrößerung Preußens getrieben. Mit der erzwungenen Öffnung des Dresdner Kabinettsarchives habe er nur versucht, seine Intrigen zu verschleiern. Österreich bedrohe Preußen nicht, sondern verteidige sich rechtmäßig. Friedrich verhält sich wortbrüchig, unköniglich und undankbar, da er vergesse, wie sich Maria Theresias Vater für ihn bei seinem Vater eingesetzt habe.",
KnF_1756-7,1756,"Flugschrift,Preußen,Brief,Sachsen,Geschichte als Argument,Soldatentum",31,"[Maubert de Gouvest, Jean Henri]","Varsovie: Zanki, 1756","Sisteme Et Conduite De La Prusse, Ou Lettres D'un General Saxon A Un Gentilhomme Silesien Dans Les Armees Prussiennes. Pour servir de Résponse Aux Manifestes, Exposés, Memoires, Remonstrances, & autres Ecrits, Du Ministere Prussien.",32 Seiten,"Schreiben eines vorgeblich sächsischen Generals im Ausland (Thüringen ) an seinen in preußischen Diensten stehenden Vetter, ein Baron aus Schlesien; der erste Brief, angeblich in Jena am 29. Oktober 1756 verfasst, reagiert auf ein Angebot des Barons an den General, ebenfalls in den Dienst Preußens zu treten.; zweites Schreiben, in Jena am 30. Oktober 1756 verfasst, setzt sich mit der am 15. Oktober 1756 durch den Geschäftsträger Preußens von der Hellen an die Generalstaaten übergebenen „Réponse du sr. de Hellen ministre du Roi auprès des Etats Généraux Au Memoire que le sr. de Cauderbach résident des Saxe a remis à leurs Hautes Puissances en date du 29 septembre 1756“ auseinander.  ",
