id,year,keywords,imagenum,_verfasser,_ort,_titel,_umfang,_inhalt,_beilagen
KnF_1757-40,1757,"Flugschrift,Brief,Schlacht,Preußen,Panegyrik",7,,"ohne Impressum, [1757]","Lettre Écrite De Königgratz par Mr. N... à un de ses amis à Breslau, au sujet de la Bataille du 28. Juin, & de la Levée du Siège de Prague.",4 Blatt,"Brief aus Königsgrätz an einen Freund in Breslau (bereits unter preußischer Herrschaft); nach der Schlacht von Kolin (18. Juni 1757) verfasst; Bezugnahme zur Belagerung Prags am 6. Mai 1757; pro Österreich; österreichischer Erfolg bei der Belagerung sei der Leistung der weniger Österreicher zu verdanken, außerdem dem Rückzug von Keith; 250 gefundene Kanonen; starkes Siegerbewusstsein; Friedrich II der Hybris bezichtigt; Sieg der Österreicher möglich durch/wegen Friedrich; Ziel Friedrichs: Einnahme Prags ohne größere Schäden.",
KnF_1757-41,1757,"Flugschrift,Sachsen,Gedicht,Kriegsbild,Soldatentum,Friede",19,,"ohne Impressum, 1757",Das bedrängte Sachsen. Zweeter Gesang.,10 Blatt,"Zweiter Gesang der „Wahrheit“ über Sachsen als Schauplatz des Krieges und die Folgen für das Land, dem Hort der Wissenschaft und Künste, dessen Untertanen die Lasten tragen, als ein Strafgericht Gottes; Trauer über den Tod der sächsischen Kurfürstin  (17. Nov. 1757); Gebet der Herrscherin; Klage  über die Besetzung Sachsens durch die Armee Friedrichs II.; Auszehrung durch die jeweiligen Armeen, die das Land durchziehen und hier den Krieg austragen; Hoffnung auf Frankreich, Franz Leopold von Nádasdy bzw. die von diesem geführten Kroaten und auf Prinz Karl; Friedrichs rächt sich wegen der Besetzung Berlins in Sachsen und nutzt dieses als Schutzschild; als Prinz den Musen und der Wissenschaft zugewandt, lässt er sich durch die Aussicht auf Schlesien zur „falschen Staatskunst“ bewegen; sein Sucht nach „Helden-Ruhm“ macht ihn zum Zerstörer und einem Brennus; Belastung Leipzigs; Zerstörung Zittaus; Ausprägung minderwertiger sächsischer Münzen.",
KnF_1757-42,1757,"Flugschrift,Streitschrift",23,,"ohne Impressum, 1757",Betrachtungen nach den Grundsätzen der Bücher-Censur über die zeither wegen der Ursache des gegenwärtigen Krieges herausgekommenen Streitschriften.,22 Seiten,"Autor gibt vor, Mitglied der „Bücher-Commission“ in Wien gewesen zu sein; die Obrigkeit, zu deren Aufgaben die Zensur gehört, sollte  bei dieser einen „Mittelweg“ beschreiten; Verhinderung von Druck und Verbreitung der Publikationen, die die Religion, Sitten, den inneren Frieden des Gemeinwesens gefährden oder die Herrscher und Regierungen beleidigen; die Obrigkeit muss auch gegen die Schriften vorgehen, die die Würde Verbündeter oder die der Gegner herabsetzt; nicht der Zensur unterliegen.
die offiziellen Publikationen der am Krieg beteiligten Staaten; solange „Einsicht“, „Vernunft“ sowie Respekt vor den Regenten die Äußerung prägen, sind auch die Schriften von Privatpersonen nicht zu beanstanden; gegen diese Grundsätze verstoßen die „Betrachtungen eines Schweitzers über die Bewegungsgründe des gegenwärtigen Krieges“.
",
KnF_1757-43,1757,"Flugschrift,Schlacht,Panegyrik,Preußen",7,,"Berlin, 1757",Zufällige Gedanken über die Schlacht bei Prag vom 6ten Mai 1757.,4 Blatt,"Verherrlichung des Sieges bei Prag (6. Mai 1757) und des Königs, der, größer als Alexander, mit seinem Schwert das Bündnis seiner Feinde zerschlägt; Großmut gegenüber Sachsen; der Sieg erfreut die „Deutschen“, da der Reichshofrat die reichsständischen Rechte beleidigt; Frankreich droht das Schicksal Österreichs und innerer Zwist; jenes wollte den Krieg und liegt nun am Boden; Klage über den Tod des Grafen Schwerin; Friedrich II. den Frieden seiner Länder und der Untertanen.",
KnF_1757-44,1757,"Flugschrift,Preußen,Sachsen,Soldatentum,Rechtsfrage,Konfession",37,,"Leipzig, 1757",Vertraute Unterredung eines Sächsischen Rekrouten und eines Preusischen Freipartheigängers den jezigen Krieg betreffend.,38 Seiten,"Diskussion über die Behandlung Sachsens durch Friedrich II. und deren Legitimität zwischen einem zwangsrekrutierten Sachsen mit einem preußischen Freiparteigänger; ersterer erhebt Klagen wegen der negativen Folgen für Kurfürsten, Land und Untertanen, der aus seiner durch nichts zu rechtfertigenden Aggression; letzterer versucht hingegen die Vorwürfe zu entkräften und seinen Landesherren zu legitimieren; dabei folgt der Preuße weitgehend der Argumentation der offiziellen preußischen Publikationen; demnach handelt es sich bei dem Einmarsch und der Besetzung um Verteidigungsmaßnahmen des Königs, zum Schutz seiner Länder vor den feindlichen Absichten des Wiener und des Dresdner Hofes sowie zur Rettung der protestantischen Religion: im Bündnis mit dem Erzhaus möchte der sächsische, katholische Kurfürst seine Untertanen zum Glaubenswechsel zwingen; im Reich werden die evangelischen Reichsstände unterdrückt, entsprechende Beschwerden nimmt der Reichshofrat nicht an; Klagen über Zwangsrekrutierungen und den mittels Prügelstrafen erzwungenen Gehorsam in der preußischen Armee; Besetzung und Zahlungen Leipzigs; Hoffnung auf Hilfe durch Reich, Frankreich, Schweden und Rußland.",
KnF_1757-45,1757,"Flugschrift,Schlacht,Preußen,Österreich,Kriegsverlauf",3,,"ohne Impressum, [1757]",Vorläuffige Umstände von dem am ersten des itzigen Monaths von der Königl. Preußischen Armee über die Oesterreichische erfochtenen Sieg.,4 Seiten," Kurze Schilderung der Schlacht bei Lobositz (1. Oktober 1757) die als preußischer Schlacht gewertet wird, da die österreichische Armee in die Flucht geschlagen worden sei; Eintreffen des Königs bei der Armee; Anmarsch der preußischen Truppen, Aufstellung für die Schlacht; Verlauf; hervorgehoben wird die Tapferkeit der preußischen Armee; keine Angaben zur Höhe der auf beiden  Seiten erlittenen Verluste; wegen ihrer Leistungen und ihres Mutes werden August Wilhelm von Braunschweig-Wolfenbüttel-Bevern und der Major der Artillerie Müller namentlich erwähnt; gefallen sind die Generalmajore von Lüderitz und von Görtze sowie der Obrist von Holtzendorf.",
KnF_1757-46,1757,"Flugschrift,Preußen,Sachsen,Natur- und Völkerrecht,Rechtsfrage,Konfession,Österreich,Reichsverfassung,Niederlande",21,,"Roterdam, 1757",Unpartheiische Gedanken eines Holländers bei dem gegenwärtigen deutschen Kriege.,22 Seiten,"Vorwürfe gegen Preußen beruhen auf „Unwahrheiten“ des Gegners, werden von Personen verbreitet, die religiösen Motiven misstrauen oder durch falsche Informationen beeinflusst sind; die Falsch- und Fehlinformationen finden sich v. a. in den Zeitungen, die „eigennützige“ Interessen verfolgen; Vorwürfe gegen Preußen: hinterlistiger Einfall in Sachsen, der gegen das Natur- und Völkerrecht verstößt, Bruch des Land- und Reichsfriedens, Begehung von Grausamkeiten;
Verteidigung mit Verweis auf „Staatsklugheit und Nothwehr“: Friedrich II. sucht die protestantische Religion und seine Länder zu schützen; Ziel der preußischen Politik ist nicht die Vorherrschaft im Reich; der Wiener Hof möchte Schlesien und Mähren erobern, Sachsen sich in den Ländern Friedrichs II. bereichern; der Wiener und der Dresdner Hof haben zur Realisierung dieser Pläne ein geheimes Abkommen mit Rußland geschlossen; beide Höfe streben außerdem den Wechsel des religiösen Bekenntnisses in Sachsen an; um diese, ihm bekannten Pläne zu durchkreuzen, nimmt er das Land in „Verwahrung“; auch als Schutzmacht der Religion ist Preußen gerechtfertigt: Kaiser und Reichshofrat agieren nicht neutral, Gravamen der protestantischen Stände werden nicht abgestellt; Holland, Schweiz und Osmanisches Reich werden sich nicht am Konflikt mit Preußen beteiligen; Schweden und Rußland dürften mit ihrem Einsatz nichts gewinnen; wenn Frankreichs Armee im Reich geschlagen wird, besteht die Möglichkeit verlorene Reichsterritorien wieder ans Reich zu bringen.
",
KnF_1757-47,1757,"Flugschrift,Preußen,Schlacht,Panegyrik,Gedicht,Konfession,Ruhm",11,,1757,Die heldenmüthige wunderbare und höchstglükliche Siege Friederich des Grosen Königes in Preusen allerunterthänigst besungen von C. D. G.,12 Seiten,"Lobgedicht auf Friedrich den II. als unüberwindlicher Sieger und Schutzherr seiner Länder und der protestantischen Religion; der Verfasser dieses Gedichts  dürfte auch die  „Parodie über das bedrängte Sachsen“ verfasst haben; umfangreiche Zitate aus „Zufällige Gedanken über die Schlacht bei Prag vom 6ten Mai 1757“; die Vorsicht rät den König den gefährlichen Plänen zuvorzukommen; Falschheit Sachsens kann durch die Öffnung des Dresdner Kabinetts bewiesen werden; ob der Siege soll Maria Theresia um Frieden bitten und die bestrafen, die ihr zum Kriege rieten; wenn sie weiter kämpft wird Friedrich II nach Wien kommen, den Frieden erzwingen und den Reichshofrat betrafen und , wenn Friedrich Wien erreicht; Frankreich droht ein schlimmes Schicksal: innerer Zwist im Land und eine preußische Armee vor sich, die entscheidend schlagen wird.",
KnF_1757-48,1757,"Flugschrift,Brief,Streitschrift,Preußen",31,"[Heyne, Christian Gottlob]",1757,Schreiben eines Buchdruckergesellens aus H. an seinen guten Freund in L. über einige bisher im Druck erschienene Schriften der Preußischen Publicisten.,32 Seiten,"Ironisch-spöttische Auseinandersetzung mit der „Flut“ von propreußisch eingestellten Privatpersonen verfassten Publikationen durch einen angeblichen „Druckergesellen“;
Geselle äußert sich nur zu den Schriften der Privatpersonen, die aus eigenem Antrieb schreiben, denen es eigentlich nicht zusteht, sich zu staatlichen Belangen zu äußern, da ihnen die Einsicht und das Wissen fehlen; zwar sehen „Natur- und Völkerrecht“ einen gefahrenabwehrenden Angriff vor, aber die vom Dresdner und vom Wiener Hof ausgehende, unmittelbare Bedrohung muss bewiesen werden; das können die propreußischen Schriften nicht belegen und somit handelt es sich beim Einmarsch in Sachsen um einen Bruch des Landfriedens; der König hatte kein Recht das Dresdner Kabinett öffnen zu lassen; die kaiserliche Dekrete und die Abrufungsgebote des Reichshofrates entsprechen dem in den Reichsgesetzen im Falle eines Bruchs des Landfriedens vorgesehen Verfahren; als Reichsstand hat der Kurfürst von Brandenburg Konflikte mit anderen Reichsständen mittels den Reichsgerichten auszutragen; das Argument, dass Kaiser und Gericht parteiisch wären, rechtfertigt nicht die in Anspruch genommene „Selbsthilfe“: man hat ja den Rechtsweg nicht bestritten; historische Beispiele für das Streben des Erzhauses nach Alleinherrschaft unter Nutzung des Reichshofrates besagen nichts über die gegenwärtige Politik.
",
KnF_1757-49,1757,"Flugschrift,Preußen,Satire",35,,"Berlin-Cölln [?], 1757",Der unpartheyisch entworfene Hohe Character Sr. Königl. Maiestät Herrn Friedrich des Andern jetzt glorwürdigst regierenden Königs in Preussen ec. ec.,36 Seiten,"Schilderung der persönlichen Eigenschaften und der äußeren Gestalt Friedrichs sowie sein Regierungsstil(?) in den ersten Regierungsjahren; in der Kronprinzenzeit bereits Neigung zu den „schönen Wissenschaften“ und Gelehrsamkeit; Kontakt mit berühmten Gelehrten seiner Zeit (u. a. Voltaire, Algarotti, Maupertius, Wolf und von Manteufel); laut Autor hat Friedrich bereits eigene Werke verfasst: Antimachiavel, Nachweis des Autors, dass der Kronprinz der Verfasser sei und umfangreiche Zitate aus der Schrift sind ebenso veröffentlicht wie positive Rezensionen; Vorbereitung auf die eigene Regierung durch die häufigere Teilnahme an den Sitzungen des Generaldirektoriums; als König ist sein wichtigstes Anliegen die Wohlfahrt des Landes und seiner Untertanen, Förderung der Wirtschaft, schützt alle christlichen Religionen ohne Unterschied und fördert die Wissenschaften; öffentliche Bauten zur Mehrung des Ansehens des Landes; bevorzugt eine seiner Majestät angemessene Pracht; hat die Armee nochmals gestärkt; einfache Kleidung im Feld; teilt hier die Strapazen der gemeinen Soldaten; fordert Disziplin auch bei seinen Offizieren und Soldaten, sowie Reinlichkeit; mehr Freude an den schönen Künsten als an der Jagd; gegen seine Gemahlin „zärtlich“ wie gegen die anderen Familienmitglieder.","[1]. Der hohe Character dieses Monarchen, entworfen in dem Commißions-Decret vom 25. Aug. 1744 Kayser, Karls des Siebenden
[2.] Ferner Kayser Karls des VII. Circular-Patent wegen der Schmettauischen Briefe, Anno 1745
[3.] Der hohe Character dieses Monarchen, aus einem an Höchst-Dieselben An. 1740 ergangenen Schreiben des ehemahligen Rußischen Kaysers, Ivan
[4.] Der hohe Character dieses Monarchen, aus einem an den König von Großbritannien, den 29. Dec. 1740 abgelassenen Schreiben
[5.] Die Patriotischen Absichten dieses Monarchen. aus einem an Höchst-Dieselben, den 17. Dec. An. 1740 ergangenen Antwort-Schreiben Sr. Majestet Königs von Pohlen und Churfürsten zu Sachsen etc.
[6.] Die durchgängig bekannte Klugheit dieses Monarchen. aus einem merckwürdigen Schreiben vom 24. Decembr. An. 1740 der Herren General-Staaten
[7.] Hoher Character des Preußischen Monarchen. aus der, auf Höchst-Deroselben Aufforderung der Festung Brieg zur Ubergabe, ertheilten Antwort des wackern Generals Piccolomini d’Arragona
[8.] Hoher Character dieses Monarchen, aus dem Pastoral-Schreiben des Cardinals von Sinzendorff
[9.] Gesinnung dieses Monarchen gegen das Oesterreichische Hauß, ex actis publicis  
"
KnF_1757-5_1,1757,"Flugschrift,Österreich,Preußen,Schlacht,Kriegsverlauf,Gedicht",5,,"Prag: Pruscha, [1757]","Gespräche In dem Reich der Todten Zwischen dem Kayserlichen Königlichen Feld-Marschallen Grafen von Broun, Und ebenfals Königlichen Preußischen Feld-Marschallen Grafen von Sverin, Nebst einer andern auf jetzige Zeit-Läuffe gerichteten Piece, der Dichter ohne Gedicht, oder der unpartheyische Poët genannt, in Teutschen Reimen verfasset.",6 Blatt,"Gespräch (Dialog) in Reimform zwischen Generalfeldmarschall Schwerin, der in der Schlacht bei Prag (6. Mai 1757) fiel, und Feldmarschall Browne, der den Folgen der in dieser Schlacht zugezogenen Verwundung erlag (26. Juni 1757); zu Beginn erklärt Schwerin den Sieg bei Prag als umfassend; Browne warnt hingegen vor der „falschen Spiel“ des Glücks und äußert seine Zuversicht, wonach auf Dauer die „Tugend“ über das „Unrecht“ siege; Browne schildert der Schlacht von Kolin  (18. Juni 1757) und deren Folgen; Nachricht vom Sieg erreicht Browne noch auf dem Sterbebett; er kann beruhigt und zuversichtlich sterben, während der Tod Schwerins die Preußen schwächte; am Ende beklagt auch dieser die Tücke des Glücks; Browne legt im Zusammenhang mit der Schlacht den Preußen in den Mund: „umsonsten riefe man; wolt ihr dann ewig leben?“",
KnF_1757-5_2,1757,"Flugschrift,Panegyrik,Gedicht,Preußen,Österreich,Kriegsalltag",5,,[1757],"Der Dichter ohne Gedicht, Oder: Der unpartheyische Poet.",,"In Endreimen verfasste Zeilen eines vorgeblich „unpartheyische[n] Poet[en]“ mit denen er diejenigen, die anhand von „Zeitungen“ – ohne jemals im realen Leben Erfahrungen gemacht zu haben –, als „Propheten“ bei „Bier, Caffée und Wein“  in Stadt und Land verspottet, die sich einbilden, den Verlauf des Krieges und die Politik der beteiligten Mächte während ihrer „Maul-Thurnieren“ beurteilen oder beeinflussen zu können; sie reden Preußen groß und geben Österreich verloren; Schicksal und Glück sind aber trügerisch und Wechselhaft, niemand kann den weiteren Verlauf vorhersehen; nach der Schlacht bei Prag schien die Stadt verloren, doch dann kam es zur Schlacht von Kolin; Friedrich II. ein „preußischer Achil“ ist persönlich mutig und beherrscht die Kunst des Krieges ebenso wie die des „Buches“, seine Soldaten sind kaum zu schlagen; letztlich liegt der Sieg aber in Hand des Herren und es gibt in der Geschichte des Erzhauses viele Beispiele für die Schutz Gottes.",
KnF_1757-50,1757,"Flugschrift,Predigt,Preußen,Schlacht",15,"Süssmilch, Johann Peter","Berlin, 1757","Der größte und herrlichste unter allen bisherigen Siegen, welchen das Königliche Preußische Heer am 6ten May 1757. bey der Böhmischen Hauptstadt Prag unter Göttlichem Beystande erfochten, wurde nach seinen edlen Früchten und Wirkungen der Gemeine zu S. Petri in Cölln in der verordneten DankPredigt vorgestellet von Johann Peter Süßmilch Königl. Preuß. Ober-Consistorial-Rath und Probst bey S. Petri.",16 Seiten,"Dankpredigt über 1. Petrus 2, 17 anlässlich des preußischen Sieges bei Prag (6. Mai 1757) als „größter“ und „herrlichster“ aller Siege; Größe des Sieges zeigt die Gerechtigkeit und die Macht Gottes, sie gemahnt die Gläubigen zu einem ihm gemäßen Leben; Gott hat die Pläne der Feinde Preußens zerschlagen, die nur auf ihre große Zahl und Kraft ihrer Waffen vertrauten; Dank und Lobpreisung Gottes; Pflichten gegenüber dem König als Gesalbten und Werkzeug des Herrn; Friedrich, ein Freund der Menschen und des Friedens wurde von seinen Gegnern als „Feind des Teutschen Vaterlandes“ verleumdet; Dank an die Armee; Gedenken an die Gefallenen und ihre Hinterbliebenen; 
Hoffnung auf baldigen Frieden.
",
KnF_1757-51,1757,"Flugschrift,Preußen,Satire",35,,"Cölln, 1757","Der unpartheyisch entworfene Hohe Character Sr. Königl. Maiestät Herrn Friedrich des Andern, jetzt glorwürdigst regierenden Königs in Preussen ec. ec.",36 Seiten,"Schilderung der persönlichen Eigenschaften und der äußeren Gestalt Friedrichs sowie sein Regierungsstil(?) in den ersten Regierungsjahren; in der Kronprinzenzeit bereits Neigung zu den „schönen Wissenschaften“ und Gelehrsamkeit; Kontakt mit berühmten Gelehrten seiner Zeit (u. a. Voltaire, Algarotti, Maupertius, Wolf und von Manteufel); laut Autor hat Friedrich bereits eigene Werke verfasst: Antimachiavel, Nachweis des Autors, dass der Kronprinz der Verfasser sei und umfangreiche Zitate aus der Schrift sind ebenso veröffentlicht wie positive Rezensionen; Vorbereitung auf die eigene Regierung durch die häufigere Teilnahme an den Sitzungen des Generaldirektoriums; als König ist sein wichtigstes Anliegen die Wohlfahrt des Landes und seiner Untertanen, Förderung der Wirtschaft, schützt alle christlichen Religionen ohne Unterschied und fördert die Wissenschaften; öffentliche Bauten zur Mehrung des Ansehens des Landes; bevorzugt eine seiner Majestät angemessene Pracht; hat die Armee nochmals gestärkt; einfache Kleidung im Feld; teilt hier die Strapazen der gemeinen Soldaten; fordert Disziplin auch bei seinen Offizieren und Soldaten, sowie Reinlichkeit; mehr Freude an den schönen Künsten als an der Jagd; gegen seine Gemahlin „zärtlich“ wie gegen die anderen Familienmitglieder.","[1]. Der hohe Character dieses Monarchen, entworfen in dem Commißions-Decret vom 25. Aug. 1744 Kayser, Karls des Siebenden
[2.] Ferner Kayser Karls des VII. Circular-Patent wegen der Schmettauischen Briefe, Anno 1745
[3.] Der hohe Character dieses Monarchen, aus einem an Höchst-Dieselben An. 1740 ergangenen Schreiben des ehemahligen Rußischen Kaysers, Ivan
[4.] Der hohe Character dieses Monarchen, aus einem an den König von Großbritannien, den 29. Dec. 1740 abgelassenen Schreiben
[5.] Die Patriotischen Absichten dieses Monarchen. aus einem an Höchst-Dieselben, den 17. Dec. An. 1740 ergangenen Antwort-Schreiben Sr. Majestet Königs von Pohlen und Churfürsten zu Sachsen etc.
[6.] Die durchgängig bekannte Klugheit dieses Monarchen. aus einem merckwürdigen Schreiben vom 24. Decembr. An. 1740 der Herren General-Staaten
[7.] Hoher Character des Preußischen Monarchen. aus der, auf Höchst-Deroselben Aufforderung der Festung Brieg zur Ubergabe, ertheilten Antwort des wackern Generals Piccolomini d’Arragona
[8.] Hoher Character dieses Monarchen, aus dem Pastoral-Schreiben des Cardinals von Sinzendorff
[9.] Gesinnung dieses Monarchen gegen das Oesterreichische Hauß, ex actis publicis  
"
KnF_1757-52,1757,"Flugschrift,Friede,Kriegsverlauf,Kriegsalltag",7,,1757,Deutlicher Kriegs- und Friedensspiegel bei Gelegenheit der Unruhen im heiligen deutschen römischen Reiche.,8 Seiten,"Schilderung der Besetzung Sachsens auf Basis des Berichtes, den der Gesandte Sachsens beim Reichstag, von Ponickau, am 16. September 1756 übergab;
Das arglose Sachsen, dessen Fürst ein „Friedensfürst“ ist, lässt sich nicht beunruhigen durch „Irrungen“ zwischen Österreich und Preußen; Reduzierung der sächsische Armee auf 14.000 Man beweist die Friedfertigkeit und die Ablehnung jeglicher Allianz; Erklärung der Neutralität; Konzentration preußischer Truppen bei Halle; Vertrauen auf das Natur- und Völkerrecht, die Gültigkeit des Landfriedens, das Kurfürstenkollegium und die Beachtung der Friedensverträge; aus dem zunächst angekündigten, der Reichsverfassung entsprechenden Durchmarsch preußischer Truppen wird ein eigenmächtiger Einmarsch; Unterhalt der preußischen Armee aus den Ressourcen Sachsens; Besetzung und Zahlungen Leipzigs; Ablehnung eines Neutralitätsabkommens durch Preußen; Besetzung Dresdens und dortigen kurfürstlichen Schlosses; Entmachtung der sächsischen Behörden und Übernahme der Verwaltung durch preußische Beamte; Aufbruch der Dresdner Geheimen Kabinettskanzlei; Unterbindung der  Korrespondenz zwischen dem Kurfürsten und seiner Gemahlin; Einschließung der sächsischen Armee sowie des Kurfürsten.
",
KnF_1757-53,1757,"Flugschrift,Schlacht,Gedicht,Briefwechsel,Preußen,Österreich",15,,1757,Zwey poetische Sendschreiben von dem durch die Kaiserl. Königl. Waffen den 18. Junii 1757. zu Chotzemitz wider den König von Preußen erfochtenen Siege.,8 Blatt,"Verherrlichung des österreichischen Sieges in der Schlacht bei Kolin (18. Juni 1757) als Erfolg, der alle bisherigen Niederlagen aufwiegt; Ruhmsucht und Stolz Friedrichs, Preußen baut auf den Erfolg seiner Waffen, darauf lässt sich aber kein stabiler Staat errichten; Aggression durch Preußen; Gottvertrauen auf der Seite Österreichs; Unrecht, List, Trug und Übermut beim Gegner; bisherige Niederlagen spornen die standhafte Maria Theresia zu verstärkten Anstrengungen an; Gott und Gerechtigkeit unterstützen Österreich; Tod des Grafen Schwerin, nicht Friedrich II und seine Armee erreichen Wien, sondern die in der Schlacht verlorenen Fahnen und Kanonen als Symbole der Niederlage Preußens.",
KnF_1757-54,1757,"Flugschrift,Streitschrift,Preußen",7,,1757,"L' Aggresseur, Prusias Et Thrason, Conte. Oder Der Aggreßor, Pruß und Thrax, Eine Erzählung.",4 Blatt,"Erzählung auf deutscher und französischer Sprache; Ausschnitt aus Demosthenes Philippische Rede (3) auf französischer und lateinischer Sprache; Auseinandersetzung zwischen Pruß und Thrax; zwei Feinde, die Frieden geschlossen haben; prekärer Frieden, und wenig Wille zum erhalten; Zusammentreffen der beiden endet in gewaltsamer Auseinadersetzung; Frage nach dem ursrpünglicher Angreifer; Auftauchen von Grotius; zeigt an, dass es schwer ist den Schuldigen zu bezeichnen; Auseinandersetzung mit Grund von Krieg und Frieden.",
KnF_1757-55,1757,"Flugschrift,Großbritannien,Polemik",15,,"Amsterdam, 1757","Nachricht von der überaus Lächerlichen Lebensart der Bergschotten, von welchen ein ansehnlich Corps zur Hannöverischen Armee stossen sollen.",15 Seiten,"Beschreibung der geographischen, klimatischen und sozialen Situation sowie der Gebräuche der Bevölkerung in den schottischen Highlands; die raue, wenig erschlossene Landschaft sowie das Wetter erschweren das Reisen und prägen das Leben der Einheimischen, Besteigung des Ben Nevis durch englische Offiziere; die Städte der Region bestehen aus wenigen, niedrigen und armseligen Holzhäusern; Ursprung der Bevölkerung vermutlich in Irland; klein an Gestalt sind die Schotten zwar gegenüber dem Wetter abgehärtet, jedoch durch ungesunde Ernährung häufig geschwächt; Bedeutung der Clans und deren Oberhäupter; allgemeine Armut unter der Bevölkerung; Hochadel; Rechtsprechung; Hochzeitsbräuche; Aberglauben; gegen die französische Armee wird das schottische Corps ähnlich den österreichischen Panduren agieren.",
KnF_1757-56,1757,"Flugschrift,Preußen,Schlacht,Gedicht,Panegyrik,Ruhm",16,,1757,Sammlung verschiedener Gedichte Auf Sr. jeztregierende Königl. Majestät in Preussen.,8 Blatt,"Zwölf Friedrich verherrlichende Gedichte; der König vereint in sich Wissenschaft, Künste, Gerechtigkeit und militärische Fähigkeiten, er ist Bauherr, Künstler, Gelehrter und gerechter Landesvater; Vergleich mit Caesar; durch die Konvention von Westminster sichert Friedrich Ruhe und Frieden im Reich, der Österreich sowie durch Frankreich und dessen überseeischen Zielen gefährdet wird; beide Länder streben vereint die „fünffte Monarchie“ an; Besetzung Sachsen sowohl zu dessen Schutz als auch zu dem der preußischen Territorien; Friedrich  beschirmt die Verfassung und die Gesetze des Reiches; Lob auf die Erfolge in den Schlachten von Lobositz, Mollwitz, Friedberg, Soor, Kesselsdorf und Chotusitz.","„Gedancken vom König“
„Atropos Reise nach Berlin“
„Auf die preiswürdige Regierung Friedrichs des Grossen“
„Auf des Königs viele Geschäfte zugleich“
„Auf die mit Engelland getroffene Vergleichs-Puncte gegen Frankreich“
„Bey der Sächsischen Invasion Anno 1756“
„Auf die Schlacht bey Loboschiz“
„Auf eben diese Schlacht“
„Auf die vorige Schlacht“
„Wunsch an den König“
„Auf den König“
„Auf das Königl. Preußische Heer am Gedächt-Tage der Schlacht bey Chotuschiz“
"
